PMID,Title,Authors,Citation,First Author,Journal/Book,Publication Year,Create Date,PMCID,NIHMS ID,DOI
17156840,MTHFR 677CC/1298CC genotypes are highly associated with chronic myelogenous leukemia: a case-control study in Korea,"Moon HW, Kim TY, Oh BR, Min HC, Cho HI, Bang SM, Lee JH, Yoon SS, Lee DS.",Leuk Res. 2007 Sep;31(9):1213-7. doi: 10.1016/j.leukres.2006.10.016. Epub 2006 Dec 6.,Moon HW,Leuk Res,2007,2006/12/13,,,10.1016/j.leukres.2006.10.016
35060542,"Effects of individualized administration of folic acid on prothrombotic state and vascular endothelial function with H-type hypertension: A double-blinded, randomized clinical cohort study","Zhang S, Wang T, Wang H, Tang J, Hou A, Yan X, Yu B, Ran S, Luo M, Tang Y, Yang R, Song D, He H.",Medicine (Baltimore). 2022 Jan 21;101(3):e28628. doi: 10.1097/MD.0000000000028628.,Zhang S,Medicine (Baltimore),2022,2022/01/21,PMC8772678,,10.1097/MD.0000000000028628
17454207,Polycystic ovary syndrome and the single nucleotide polymorphisms of methylenetetrahydrofolate reductase: a pilot observational study,"Palep-Singh M, Picton HM, Yates ZR, Barth J, Balen AH.",Hum Fertil (Camb). 2007 Mar;10(1):33-41. doi: 10.1080/14647270600950157.,Palep-Singh M,Hum Fertil (Camb),2007,2007/04/25,,,10.1080/14647270600950157
11584084,Polymorphisms of key enzymes in homocysteine metabolism affect diet responsiveness of plasma homocysteine in healthy women,"Silaste ML, Rantala M, Sämpi M, Alfthan G, Aro A, Kesäniemi YA.",J Nutr. 2001 Oct;131(10):2643-7. doi: 10.1093/jn/131.10.2643.,Silaste ML,J Nutr,2001,2001/10/05,,,10.1093/jn/131.10.2643
24711158,Effects of Italian Mediterranean organic diet vs. low-protein diet in nephropathic patients according to MTHFR genotypes,"Di Daniele N, Di Renzo L, Noce A, Iacopino L, Ferraro PM, Rizzo M, Sarlo F, Domino E, De Lorenzo A.",J Nephrol. 2014 Oct;27(5):529-36. doi: 10.1007/s40620-014-0067-y. Epub 2014 Apr 8.,Di Daniele N,J Nephrol,2014,2014/04/09,,,10.1007/s40620-014-0067-y
12730409,Methylenetetrahydrofolate reductase 677C-->T variant modulates folate status response to controlled folate intakes in young women,"Guinotte CL, Burns MG, Axume JA, Hata H, Urrutia TF, Alamilla A, McCabe D, Singgih A, Cogger EA, Caudill MA.",J Nutr. 2003 May;133(5):1272-80. doi: 10.1093/jn/133.5.1272.,Guinotte CL,J Nutr,2003,2003/05/06,,,10.1093/jn/133.5.1272
23803097,The methylenetetrahydrofolate reductase C677T polymorphism influences risk of esophageal cancer in Chinese,"Qu HH, Cui LH, Wang K, Wang P, Song CH, Wang KJ, Zhang JY, Dai LP.",Asian Pac J Cancer Prev. 2013;14(5):3163-8. doi: 10.7314/apjcp.2013.14.5.3163.,Qu HH,Asian Pac J Cancer Prev,2013,2013/06/28,,,10.7314/apjcp.2013.14.5.3163
17900242,Methylenetetrahydrofolate reductase C677T polymorphism and liver fibrosis progression in patients with recurrent hepatitis C,"Toniutto P, Fabris C, Falleti E, Cussigh A, Fontanini E, Bitetto D, Fornasiere E, Minisini R, De Feo T, Marangoni F, Pirisi M.",Liver Int. 2008 Feb;28(2):257-63. doi: 10.1111/j.1478-3231.2007.01591.x. Epub 2007 Sep 26.,Toniutto P,Liver Int,2008,2007/09/29,,,10.1111/j.1478-3231.2007.01591.x
24083702,Allele and genotype frequencies of the polymorphic methylenetetrahydrofolate reductase and colorectal cancer among Jordanian population,"Yousef AM, Shomaf M, Berger S, Ababneh N, Bobali Y, Ali D, Al-Hasan S, Diab O, Ismail S.",Asian Pac J Cancer Prev. 2013;14(8):4559-65. doi: 10.7314/apjcp.2013.14.8.4559.,Yousef AM,Asian Pac J Cancer Prev,2013,2013/10/03,,,10.7314/apjcp.2013.14.8.4559
15582752,"Contribution of the MTHFR gene to the causal pathway for depression, anxiety and cognitive impairment in later life","Almeida OP, Flicker L, Lautenschlager NT, Leedman P, Vasikaran S, van Bockxmeer FM.",Neurobiol Aging. 2005 Feb;26(2):251-7. doi: 10.1016/j.neurobiolaging.2004.03.007.,Almeida OP,Neurobiol Aging,2005,2004/12/08,,,10.1016/j.neurobiolaging.2004.03.007
15952099,"Prevalence of hyperhomocysteinemia in adult gluten-sensitive enteropathy at diagnosis: role of B12, folate, and genetics","Saibeni S, Lecchi A, Meucci G, Cattaneo M, Tagliabue L, Rondonotti E, Formenti S, De Franchis R, Vecchi M.",Clin Gastroenterol Hepatol. 2005 Jun;3(6):574-80. doi: 10.1016/s1542-3565(05)00022-4.,Saibeni S,Clin Gastroenterol Hepatol,2005,2005/06/14,,,10.1016/s1542-3565(05)00022-4
20831652,Methylenetetrahydrofolate reductase C677T polymorphism in patients with Henoch-Schönlein purpura,"Emre S, Sirin A, Ergen A, Bilge I, Sucu A, Yilmaz A, Isbir T.",Pediatr Int. 2011 Jun;53(3):358-62. doi: 10.1111/j.1442-200X.2010.03247.x.,Emre S,Pediatr Int,2011,2010/09/14,,,10.1111/j.1442-200X.2010.03247.x
17389614,Folate-related genes and the risk of tobacco-related cancers in Central Europe,"Hung RJ, Hashibe M, McKay J, Gaborieau V, Szeszenia-Dabrowska N, Zaridze D, Lissowska J, Rudnai P, Fabianova E, Mates I, Foretova L, Janout V, Bencko V, Chabrier A, Moullan N, Canzian F, Hall J, Boffetta P, Brennan P.",Carcinogenesis. 2007 Jun;28(6):1334-40. doi: 10.1093/carcin/bgm067. Epub 2007 Mar 26.,Hung RJ,Carcinogenesis,2007,2007/03/29,,,10.1093/carcin/bgm067
21869730,Effect of folic acid intervention on the change of serum folate level in hypertensive Chinese adults: do methylenetetrahydrofolate reductase and methionine synthase gene polymorphisms affect therapeutic responses?,"Qin X, Li J, Cui Y, Liu Z, Zhao Z, Ge J, Guan D, Hu J, Wang Y, Zhang F, Xu X, Wang X, Xu X, Huo Y.",Pharmacogenet Genomics. 2012 Jun;22(6):421-8. doi: 10.1097/FPC.0b013e32834ac5e8.,Qin X,Pharmacogenet Genomics,2012,2011/08/27,,,10.1097/FPC.0b013e32834ac5e8
12001978,Nutritional advice to increase soluble fibre intake does not change plasma folate or homocysteine in men with angina: a randomised controlled trial,"Ashfield-Watt PA, Clark ZE, Breay P, Zotos PC, Cale SB, Burr ML, McDowell IF.",Public Health Nutr. 2002 Feb;5(1):47-53. doi: 10.1079/PHN2001250.,Ashfield-Watt PA,Public Health Nutr,2002,2002/05/11,,,10.1079/PHN2001250
20220206,Choline intake exceeding current dietary recommendations preserves markers of cellular methylation in a genetic subgroup of folate-compromised men,"Shin W, Yan J, Abratte CM, Vermeylen F, Caudill MA.",J Nutr. 2010 May;140(5):975-80. doi: 10.3945/jn.110.121186. Epub 2010 Mar 10.,Shin W,J Nutr,2010,2010/03/12,PMC2855263,,10.3945/jn.110.121186
17967524,Association between polymorphisms of folate-metabolizing enzymes and risk of prostate cancer,"Marchal C, Redondo M, Reyes-Engel A, Perea-Milla E, Gaitan MJ, Machuca J, Diaz F, Caballero J, Carnero J.",Eur J Surg Oncol. 2008 Jul;34(7):805-10. doi: 10.1016/j.ejso.2007.09.008. Epub 2007 Oct 29.,Marchal C,Eur J Surg Oncol,2008,2007/10/31,,,10.1016/j.ejso.2007.09.008
16365871,Migraine and MTHFR C677T genotype in a population-based sample,"Scher AI, Terwindt GM, Verschuren WM, Kruit MC, Blom HJ, Kowa H, Frants RR, van den Maagdenberg AM, van Buchem M, Ferrari MD, Launer LJ.",Ann Neurol. 2006 Feb;59(2):372-5. doi: 10.1002/ana.20755.,Scher AI,Ann Neurol,2006,2005/12/21,,,10.1002/ana.20755
26630680,Methyltetrahydrofolate vs Folic Acid Supplementation in Idiopathic Recurrent Miscarriage with Respect to Methylenetetrahydrofolate Reductase C677T and A1298C Polymorphisms: A Randomized Controlled Trial,"Hekmatdoost A, Vahid F, Yari Z, Sadeghi M, Eini-Zinab H, Lakpour N, Arefi S.",PLoS One. 2015 Dec 2;10(12):e0143569. doi: 10.1371/journal.pone.0143569. eCollection 2015.,Hekmatdoost A,PLoS One,2015,2015/12/03,PMC4668025,,10.1371/journal.pone.0143569
16802358,Homocysteine levels and disease duration independently correlate with coronary artery calcification in patients with systemic lupus erythematosus,"Von Feldt JM, Scalzi LV, Cucchiara AJ, Morthala S, Kealey C, Flagg SD, Genin A, Van Dyke AL, Nackos E, Chander A, Gehrie E, Cron RQ, Whitehead AS.",Arthritis Rheum. 2006 Jul;54(7):2220-7. doi: 10.1002/art.21967.,Von Feldt JM,Arthritis Rheum,2006,2006/06/28,,,10.1002/art.21967
23856660,"Influence of nitrous oxide anesthesia, B-vitamins, and MTHFR gene polymorphisms on perioperative cardiac events: the vitamins in nitrous oxide (VINO) randomized trial","Nagele P, Brown F, Francis A, Scott MG, Gage BF, Miller JP; VINO Study Team.",Anesthesiology. 2013 Jul;119(1):19-28. doi: 10.1097/ALN.0b013e31829761e3.,Nagele P,Anesthesiology,2013,2013/07/17,PMC3919550,NIHMS538248,10.1097/ALN.0b013e31829761e3
27384413,Maternal gene-micronutrient interactions related to one-carbon metabolism and the risk of myelomeningocele among offspring,"Nguyen MP, Lupo PJ, Northrup H, Morrison AC, Cirino PT, Au KS.",Birth Defects Res. 2017 Jan 30;109(2):99-105. doi: 10.1002/bdra.23538.,Nguyen MP,Birth Defects Res,2017,2016/07/08,PMC5250578,NIHMS842169,10.1002/bdra.23538
15548759,Folate levels determine effect of antioxidant supplementation on micronuclei in subjects with cardiovascular risk,"Smolková B, Dusinská M, Raslová K, Barancoková M, Kazimírová A, Horská A, Spustová V, Collins A.",Mutagenesis. 2004 Nov;19(6):469-76. doi: 10.1093/mutage/geh059.,Smolková B,Mutagenesis,2004,2004/11/19,,,10.1093/mutage/geh059
14994919,"MTHFR C677T mutation, factor II G20210A mutation and factor V Leiden as risks factor for youth retinal vein occlusion","Cruciani F, Moramarco A, Curto T, Labate A, Recupero V, Conti L, Gandolfo GM, Balacco Gabrieli C.",Clin Ter. 2003 Sep-Oct;154(5):299-303.,Cruciani F,Clin Ter,2003,2004/03/05,,,
16936384,Methylenetetrahydrofolate reductase gene polymorphism in Indian stroke patients,"Kalita J, Srivastava R, Bansal V, Agarwal S, Misra UK.",Neurol India. 2006 Sep;54(3):260-3. doi: 10.4103/0028-3886.27148.,Kalita J,Neurol India,2006,2006/08/29,,,10.4103/0028-3886.27148
31440871,"Association of plasma homocysteine level with vaso-occlusive crisis in sickle cell anemia patients of Odisha, India","Meher S, Patel S, Das K, Dehury S, Jit BP, Maske MM, Das P, Dash BP, Mohanty PK.",Ann Hematol. 2019 Oct;98(10):2257-2265. doi: 10.1007/s00277-019-03776-x. Epub 2019 Aug 22.,Meher S,Ann Hematol,2019,2019/08/24,,,10.1007/s00277-019-03776-x
16365753,Methylenetetrahydrofolate reductase polymorphism and minor increase of risk for oral cancer,"Vairaktaris E, Yapijakis C, Kessler P, Vylliotis A, Ries J, Wiltfang J, Vassiliou S, Derka S, Neukam FW.",J Cancer Res Clin Oncol. 2006 Apr;132(4):219-22. doi: 10.1007/s00432-005-0065-5. Epub 2005 Dec 20.,Vairaktaris E,J Cancer Res Clin Oncol,2006,2005/12/21,PMC12161061,,10.1007/s00432-005-0065-5
20721969,Polymorphisms of methylenetetrahydrofolate reductase are associated with a high risk of nasopharyngeal carcinoma in a smoking population from Southern China,"Cao Y, Miao XP, Huang MY, Deng L, Liang XM, Lin DX, Zeng YX, Shao JY.",Mol Carcinog. 2010 Nov;49(11):928-34. doi: 10.1002/mc.20669.,Cao Y,Mol Carcinog,2010,2010/08/20,,,10.1002/mc.20669
20669348,Effect of enalapril on plasma homocysteine levels in patients with essential hypertension,"Fan FF, Huo Y, Wang X, Xu X, Wang BY, Xu XP, Li JP.",J Zhejiang Univ Sci B. 2010 Aug;11(8):583-91. doi: 10.1631/jzus.B1001003.,Fan FF,J Zhejiang Univ Sci B,2010,2010/07/30,PMC2916091,,10.1631/jzus.B1001003
15073633,"C677T polymorphism of the MTHFR gene and variant hemoglobins: a study in newborns from Salvador, Bahia, Brazil","Couto FD, Adorno EV, Menezes JF, Moura Neto JP, Rêgo MA, Reis MG, Gonçalves MS.",Cad Saude Publica. 2004 Mar-Apr;20(2):529-33. doi: 10.1590/s0102-311x2004000200021. Epub 2004 Apr 6.,Couto FD,Cad Saude Publica,2004,2004/04/10,,,10.1590/s0102-311x2004000200021
29685716,Homocysteine and Incident Atrial Fibrillation: The Atherosclerosis Risk in Communities Study and the Multi-Ethnic Study of Atherosclerosis,"Kubota Y, Alonso A, Heckbert SR, Norby FL, Folsom AR.",Heart Lung Circ. 2019 Apr;28(4):615-622. doi: 10.1016/j.hlc.2018.03.007. Epub 2018 Mar 21.,Kubota Y,Heart Lung Circ,2019,2018/04/25,PMC6150836,NIHMS953513,10.1016/j.hlc.2018.03.007
18234410,Evaluation of the relationship between C677T variants of methylenetetrahydrofolate reductase gene and hyperhomocysteinemia in children receiving antiepileptic drug therapy,"Vurucu S, Demirkaya E, Kul M, Unay B, Gul D, Akin R, Gokçay E.",Prog Neuropsychopharmacol Biol Psychiatry. 2008 Apr 1;32(3):844-8. doi: 10.1016/j.pnpbp.2007.12.018. Epub 2008 Jan 29.,Vurucu S,Prog Neuropsychopharmacol Biol Psychiatry,2008,2008/02/01,,,10.1016/j.pnpbp.2007.12.018
25921104,Allele and Genotype Frequencies of the Polymorphic Methylenetetrahydrofolate Reductase and Lung Cancer in ther Jordanian Population: a Case Control Study,"Al-Motassem Y, Shomaf M, Said I, Berger S, Ababneh N, Diab O, Obeidat N, Awidi A.",Asian Pac J Cancer Prev. 2015;16(8):3101-9. doi: 10.7314/apjcp.2015.16.8.3101.,Al-Motassem Y,Asian Pac J Cancer Prev,2015,2015/04/30,,,10.7314/apjcp.2015.16.8.3101
10916110,Hyperhomocysteinemia in hemodialysis patients: effects of 12-month supplementation with hydrosoluble vitamins,"Tremblay R, Bonnardeaux A, Geadah D, Busque L, Lebrun M, Ouimet D, Leblanc M.",Kidney Int. 2000 Aug;58(2):851-8. doi: 10.1046/j.1523-1755.2000.00234.x.,Tremblay R,Kidney Int,2000,2000/08/01,,,10.1046/j.1523-1755.2000.00234.x
16055253,Homocysteinemia as well as methylenetetrahydrofolate reductase polymorphism are associated with affective psychoses,"Reif A, Pfuhlmann B, Lesch KP.",Prog Neuropsychopharmacol Biol Psychiatry. 2005 Sep;29(7):1162-8. doi: 10.1016/j.pnpbp.2005.06.027.,Reif A,Prog Neuropsychopharmacol Biol Psychiatry,2005,2005/08/02,,,10.1016/j.pnpbp.2005.06.027
19307503,Randomized phase II and pharmacogenetic study of pemetrexed compared with pemetrexed plus carboplatin in pretreated patients with advanced non-small-cell lung cancer,"Smit EF, Burgers SA, Biesma B, Smit HJ, Eppinga P, Dingemans AM, Joerger M, Schellens JH, Vincent A, van Zandwijk N, Groen HJ.",J Clin Oncol. 2009 Apr 20;27(12):2038-45. doi: 10.1200/JCO.2008.19.1650. Epub 2009 Mar 23.,Smit EF,J Clin Oncol,2009,2009/03/25,,,10.1200/JCO.2008.19.1650
20417243,"Breast cancer risk, dietary intake, and methylenetetrahydrofolate reductase (MTHFR)single nucleotide polymorphisms",Alshatwi AA.,Food Chem Toxicol. 2010 Jul;48(7):1881-5. doi: 10.1016/j.fct.2010.04.028. Epub 2010 Apr 22.,Alshatwi AA,Food Chem Toxicol,2010,2010/04/27,,,10.1016/j.fct.2010.04.028
22108397,Comparison of the frequency of the methylenetetrahydrofolate reductase (MTHFR) C677T polymorphism in depressed versus nondepressed patients,"Lizer MH, Bogdan RL, Kidd RS.",J Psychiatr Pract. 2011 Nov;17(6):404-9. doi: 10.1097/01.pra.0000407963.26981.a6.,Lizer MH,J Psychiatr Pract,2011,2011/11/24,,,10.1097/01.pra.0000407963.26981.a6
15342443,"Associations between two common variants C677T and A1298C in the methylenetetrahydrofolate reductase gene and measures of folate metabolism and DNA stability (strand breaks, misincorporated uracil, and DNA methylation status) in human lymphocytes in vivo","Narayanan S, McConnell J, Little J, Sharp L, Piyathilake CJ, Powers H, Basten G, Duthie SJ.",Cancer Epidemiol Biomarkers Prev. 2004 Sep;13(9):1436-43.,Narayanan S,Cancer Epidemiol Biomarkers Prev,2004,2004/09/03,,,
19515015,High plasma homocysteine levels contribute to the risk of stroke recurrence and all-cause mortality in a large prospective stroke population,"Zhang W, Sun K, Chen J, Liao Y, Qin Q, Ma A, Wang D, Zhu Z, Wang Y, Hui R.",Clin Sci (Lond). 2009 Oct 26;118(3):187-94. doi: 10.1042/CS20090142.,Zhang W,Clin Sci (Lond),2009,2009/06/12,,,10.1042/CS20090142
16076517,Further evidence that hyperhomocysteinemia and methylenetetrahydrofolate reductase C677T and A1289C polymorphisms are not risk factors for schizophrenia,"Vilella E, Virgos C, Murphy M, Martorell L, Valero J, Simó JM, Joven J, Fernández-Ballart J, Labad A.",Prog Neuropsychopharmacol Biol Psychiatry. 2005 Sep;29(7):1169-74. doi: 10.1016/j.pnpbp.2005.07.001.,Vilella E,Prog Neuropsychopharmacol Biol Psychiatry,2005,2005/08/04,,,10.1016/j.pnpbp.2005.07.001
17574929,"Coronary reactivity, homocysteine and methylenetetrahydrofolate reductase gene variation in young men during pravastatin therapy","Nieminen T, Knuuti J, Hämelahti P, Kähönen M, Laaksonen R, Janatuinen T, Vesalainen R, Nuutila P, Jokela H, Lehtimäki T.",Vascul Pharmacol. 2007 Aug-Sep;47(2-3):113-7. doi: 10.1016/j.vph.2007.05.001. Epub 2007 May 13.,Nieminen T,Vascul Pharmacol,2007,2007/06/19,,,10.1016/j.vph.2007.05.001
15046559,Effect of C677T methylenetetrahydrofolate reductase gene polymorphism on plasma homocysteine levels in ethnic groups,"Gasparovic J, Raslová K, Basistová Z, Zacharová M, Wsólová L, Avdicová M, Blazícek P, Lietava J, Siváková D.",Physiol Res. 2004;53(2):215-8.,Gasparovic J,Physiol Res,2004,2004/03/30,,,
22889494,Pharmacogenetic study of patients with advanced non-small cell lung cancer (NSCLC) treated with second-line pemetrexed or pemetrexed-carboplatin,"Tiseo M, Giovannetti E, Tibaldi C, Camerini A, Di Costanzo F, Barbieri F, Burgers JA, Vincent A, Peters GJ, Smit EF, Ardizzoni A.",Lung Cancer. 2012 Oct;78(1):92-9. doi: 10.1016/j.lungcan.2012.07.009. Epub 2012 Aug 11.,Tiseo M,Lung Cancer,2012,2012/08/15,,,10.1016/j.lungcan.2012.07.009
15154859,MTHFR T677 homozygosis influences the presence of aura in migraineurs,"Oterino A, Valle N, Bravo Y, Muñoz P, Sánchez-Velasco P, Ruiz-Alegría C, Castillo J, Leyva-Cobián F, Vadillo A, Pascual J.",Cephalalgia. 2004 Jun;24(6):491-4. doi: 10.1111/j.1468-2982.2004.00692.x.,Oterino A,Cephalalgia,2004,2004/05/25,,,10.1111/j.1468-2982.2004.00692.x
12614926,"Hypertrophy of IMC of carotid artery in Parkinson's disease is associated with L-DOPA, homocysteine, and MTHFR genotype","Nakaso K, Yasui K, Kowa H, Kusumi M, Ueda K, Yoshimoto Y, Takeshima T, Sasaki K, Nakashima K.",J Neurol Sci. 2003 Mar 15;207(1-2):19-23. doi: 10.1016/s0022-510x(02)00353-2.,Nakaso K,J Neurol Sci,2003,2003/03/05,,,10.1016/s0022-510x(02)00353-2
27409003,G80A Single Nucleotide Polymorphism in Reduced Folate Carrier-1 Gene in a Mexican Population and its Impact on Survival in Patients with Acute Lymphoblastic Leukemia,"Candelaria M, Ojeda J, Gutiérrez-Hernández O, Taja-Chayeb L, Vidal-Millán S, Dueñas-González A.",Rev Invest Clin. 2016 May-Jun;68(3):154-62.,Candelaria M,Rev Invest Clin,2016,2016/07/14,,,
21966393,No effect of folic acid supplementation on global DNA methylation in men and women with moderately elevated homocysteine,"Jung AY, Smulders Y, Verhoef P, Kok FJ, Blom H, Kok RM, Kampman E, Durga J.",PLoS One. 2011;6(9):e24976. doi: 10.1371/journal.pone.0024976. Epub 2011 Sep 23.,Jung AY,PLoS One,2011,2011/10/04,PMC3179474,,10.1371/journal.pone.0024976
12612987,The methylentetrahydrofolate reductase C677T point mutation is a risk factor for vascular access thrombosis in hemodialysis patients,"Fukasawa M, Matsushita K, Kamiyama M, Mikami Y, Araki I, Yamagata Z, Takeda M.",Am J Kidney Dis. 2003 Mar;41(3):637-42. doi: 10.1053/ajkd.2003.50125.,Fukasawa M,Am J Kidney Dis,2003,2003/03/04,,,10.1053/ajkd.2003.50125
15126006,Genetic polymorphism of methylenetetrahydrofolate reductase as a risk factor for diabetic nephropathy in Chinese type 2 diabetic patients,"Sun J, Xu Y, Zhu Y, Lu H.",Diabetes Res Clin Pract. 2004 Jun;64(3):185-90. doi: 10.1016/j.diabres.2003.10.022.,Sun J,Diabetes Res Clin Pract,2004,2004/05/06,,,10.1016/j.diabres.2003.10.022
17114913,"Methylenetetrahydrofolate reductase gene polymorphism, homocysteine and risk of macroangiopathy in Type 2 diabetes mellitus","Sun J, Xu Y, Zhu Y, Lu H.",J Endocrinol Invest. 2006 Oct;29(9):814-20. doi: 10.1007/BF03347376.,Sun J,J Endocrinol Invest,2006,2006/11/23,,,10.1007/BF03347376
16564429,Genetic investigation of methylenetetrahydrofolate reductase (MTHFR) and catechol-O-methyl transferase (COMT) in multiple sclerosis,"Tajouri L, Martin V, Gasparini C, Ovcaric M, Curtain R, Lea RA, Haupt LM, Csurhes P, Pender MP, Griffiths LR.",Brain Res Bull. 2006 Apr 14;69(3):327-31. doi: 10.1016/j.brainresbull.2006.01.005. Epub 2006 Jan 24.,Tajouri L,Brain Res Bull,2006,2006/03/28,,,10.1016/j.brainresbull.2006.01.005
12182910,Hyperhomocysteinemia and venous thromboembolism: a risk factor more prevalent in the elderly and in idiopathic cases,"Hainaut P, Jaumotte C, Verhelst D, Wallemacq P, Gala JL, Lavenne E, Heusterspreute M, Zech F, Moriau M.",Thromb Res. 2002 Apr 15;106(2):121-5. doi: 10.1016/s0049-3848(02)00096-8.,Hainaut P,Thromb Res,2002,2002/08/17,,,10.1016/s0049-3848(02)00096-8
11710708,The C677T mutation in the methylenetetrahydrofolate reductase gene: a genetic risk factor for methotrexate-related elevation of liver enzymes in rheumatoid arthritis patients,"van Ede AE, Laan RF, Blom HJ, Huizinga TW, Haagsma CJ, Giesendorf BA, de Boo TM, van de Putte LB.",Arthritis Rheum. 2001 Nov;44(11):2525-30. doi: 10.1002/1529-0131(200111)44:11<2525::aid-art432>3.0.co;2-b.,van Ede AE,Arthritis Rheum,2001,2001/11/17,,,10.1002/1529-0131(200111)44:11<2525::aid-art432>3.0.co;2-b
15336613,"Association of plasma folate, plasma total homocysteine, but not methylenetetrahydrofolate reductase C667T polymorphism, with bone mineral density in postmenopausal Iranian women: a cross-sectional study","Golbahar J, Hamidi A, Aminzadeh MA, Omrani GR.",Bone. 2004 Sep;35(3):760-5. doi: 10.1016/j.bone.2004.04.018.,Golbahar J,Bone,2004,2004/09/01,,,10.1016/j.bone.2004.04.018
15217535,Effect of the methylenetetrahydrofolate reductase C677T polymorphism on patients with cisplatin/gemcitabine-treated stage IV non-small-cell lung cancer,"Alberola V, Sarries C, Rosell R, Taron M, de las Peñas R, Camps C, Massuti B, Insa A, Garcia-Gomez R, Isla D, Artal A, Muñoz MA, Cobo M, Bover I, Gonzalez-Larria JL, Terrasa J, Almenar D, Barcelo R, Diz P, Sanchez-Ronco M, Sanchez JJ.",Clin Lung Cancer. 2004 May;5(6):360-5. doi: 10.3816/clc.2004.n.014.,Alberola V,Clin Lung Cancer,2004,2004/06/26,,,10.3816/clc.2004.n.014
11600611,Phase I clinical and pharmacogenetic trial of irinotecan and raltitrexed administered every 21 days to patients with cancer,"Stevenson JP, Redlinger M, Kluijtmans LA, Sun W, Algazy K, Giantonio B, Haller DG, Hardy C, Whitehead AS, O'Dwyer PJ.",J Clin Oncol. 2001 Oct 15;19(20):4081-7. doi: 10.1200/JCO.2001.19.20.4081.,Stevenson JP,J Clin Oncol,2001,2001/10/16,,,10.1200/JCO.2001.19.20.4081
11054348,A C677T mutation in the methylenetetrahydrofolate reductase gene modifies serum cysteine in dialysis patients,"Kimura H, Gejyo F, Suzuki S, Takeda T, Miyazaki R, Yoshida H.",Am J Kidney Dis. 2000 Nov;36(5):925-33. doi: 10.1053/ajkd.2000.19085.,Kimura H,Am J Kidney Dis,2000,2000/10/31,,,10.1053/ajkd.2000.19085
28689750,"Characteristics and Long-Term Prognosis of Patients ≤35 Years of Age with ST Segment Elevation Myocardial Infarction and ""Normal or Near Normal"" Coronary Arteries","Rallidis LS, Gialeraki A, Triantafyllis AS, Tsirebolos G, Liakos G, Moutsatsou P, Iliodromitis E.",Am J Cardiol. 2017 Sep 1;120(5):740-746. doi: 10.1016/j.amjcard.2017.06.002. Epub 2017 Jun 13.,Rallidis LS,Am J Cardiol,2017,2017/07/11,,,10.1016/j.amjcard.2017.06.002
15138617,The methylenetetrahydrofolate reductase C677T polymorphism is a major determinant of coffee-induced increase of plasma homocysteine: a randomized placebo controlled study,"Strandhagen E, Zetterberg H, Aires N, Palmér M, Rymo L, Blennow K, Landaas S, Thelle DS.",Int J Mol Med. 2004 Jun;13(6):811-5.,Strandhagen E,Int J Mol Med,2004,2004/05/13,,,
12747593,"Genetic variations observed in arterial and venous thromboembolism--relevance for therapy, risk prevention and prognosis","Harrington DJ, Malefora A, Schmeleva V, Kapustin S, Papayan L, Blinov M, Harrington P, Mitchell M, Savidge GF.",Clin Chem Lab Med. 2003 Apr;41(4):496-500. doi: 10.1515/CCLM.2003.075.,Harrington DJ,Clin Chem Lab Med,2003,2003/05/16,,,10.1515/CCLM.2003.075
12114885,Effect of long-term hormone replacement therapy on plasma homocysteine in postmenopausal women: a randomized controlled study,"Madsen JS, Kristensen SR, Klitgaard NA, Bladbjerg EM, Abrahamsen B, Stilgren L, Jespersen J.",Am J Obstet Gynecol. 2002 Jul;187(1):33-9. doi: 10.1067/mob.2002.123030.,Madsen JS,Am J Obstet Gynecol,2002,2002/07/13,,,10.1067/mob.2002.123030
19075497,Increasing the number of SNP loci does not necessarily improve prediction power at least in the comparison of MTHFR SNP and haplotypes,"Miyaki K, Takahashi Y, Song Y, Zhang L, Muramatsu M, Nakayama T.",J Epidemiol. 2008;18(6):243-50. doi: 10.2188/jea.je2008022. Epub 2008 Dec 9.,Miyaki K,J Epidemiol,2008,2008/12/18,PMC4771609,,10.2188/jea.je2008022
10833330,Investigation of folate pathway gene polymorphisms and the incidence of neural tube defects in a Texas hispanic population,"Barber R, Shalat S, Hendricks K, Joggerst B, Larsen R, Suarez L, Finnell R.",Mol Genet Metab. 2000 May;70(1):45-52. doi: 10.1006/mgme.2000.2991.,Barber R,Mol Genet Metab,2000,2000/06/02,,,10.1006/mgme.2000.2991
15003888,Methylenetetrahydrofolate reductase genotypes do not play a role in acute lymphoblastic leukemia pathogenesis in the Italian population,"Chiusolo P, Reddiconto G, Cimino G, Sica S, Fiorini A, Farina G, Vitale A, Sorà F, Laurenti L, Bartolozzi F, Fazi P, Mandelli F, Leone G.",Haematologica. 2004 Feb;89(2):139-44.,Chiusolo P,Haematologica,2004,2004/03/09,,,
24490800,A retrospective comparative exploratory study on two methylentetrahydrofolate reductase (MTHFR) polymorphisms in esophagogastric cancer: the A1298C MTHFR polymorphism is an independent prognostic factor only in neoadjuvantly treated gastric cancer patients,"Blank S, Rachakonda S, Keller G, Weichert W, Lordick F, Langer R, Springfeld C, Bruckner T, Becker K, Kumar R, Ott K.",BMC Cancer. 2014 Feb 3;14:58. doi: 10.1186/1471-2407-14-58.,Blank S,BMC Cancer,2014,2014/02/05,PMC3922603,,10.1186/1471-2407-14-58
