PMID,Title,Authors,Citation,First Author,Journal/Book,Publication Year,Create Date,PMCID,NIHMS ID,DOI
40362912,Safety and Efficacy of High-Dose Folinic Acid in Children with Autism: The Impact of Folate Metabolism Gene Polymorphisms,"Zhang C, Chen Y, Hou F, Li Y, Wang W, Guo L, Zhang C, Li L, Lu C.",Nutrients. 2025 May 7;17(9):1602. doi: 10.3390/nu17091602.,Zhang C,Nutrients,2025,2025/05/14,PMC12073535,,10.3390/nu17091602
25771069,Efficacy of folic acid therapy in primary prevention of stroke among adults with hypertension in China: the CSPPT randomized clinical trial,"Huo Y, Li J, Qin X, Huang Y, Wang X, Gottesman RF, Tang G, Wang B, Chen D, He M, Fu J, Cai Y, Shi X, Zhang Y, Cui Y, Sun N, Li X, Cheng X, Wang J, Yang X, Yang T, Xiao C, Zhao G, Dong Q, Zhu D, Wang X, Ge J, Zhao L, Hu D, Liu L, Hou FF; CSPPT Investigators.",JAMA. 2015 Apr 7;313(13):1325-35. doi: 10.1001/jama.2015.2274.,Huo Y,JAMA,2015,2015/03/16,,,10.1001/jama.2015.2274
35562805,Association between serum 5-methyltetrahydrofolate and homocysteine in Chinese hypertensive participants with different MTHFR C677T polymorphisms: a cross-sectional study,"Cheng Y, Liu S, Chen D, Yang Y, Liang Q, Huo Y, Zhou Z, Zhang N, Wang Z, Liu L, Song Y, Liu X, Duan Y, Liang X, Hou B, Wang B, Tang G, Qin X, Yan F.",Nutr J. 2022 May 13;21(1):29. doi: 10.1186/s12937-022-00786-w.,Cheng Y,Nutr J,2022,2022/05/13,PMC9102656,,10.1186/s12937-022-00786-w
29371246,MTHFR Gene and Serum Folate Interaction on Serum Homocysteine Lowering: Prospect for Precision Folic Acid Treatment,"Huang X, Qin X, Yang W, Liu L, Jiang C, Zhang X, Jiang S, Bao H, Su H, Li P, He M, Song Y, Zhao M, Yin D, Wang Y, Zhang Y, Li J, Yang R, Wu Y, Hong K, Wu Q, Chen Y, Sun N, Li X, Tang G, Wang B, Cai Y, Hou FF, Huo Y, Wang H, Wang X, Cheng X.",Arterioscler Thromb Vasc Biol. 2018 Mar;38(3):679-685. doi: 10.1161/ATVBAHA.117.310211. Epub 2018 Jan 25.,Huang X,Arterioscler Thromb Vasc Biol,2018,2018/01/27,,,10.1161/ATVBAHA.117.310211
38478042,Optimal folic acid dosage in lowering homocysteine: Precision Folic Acid Trial to lower homocysteine (PFAT-Hcy),"Huang X, Bao H, Ding C, Li J, Cao T, Liu L, Wei Y, Zhou Z, Zhang N, Song Y, Chen P, Jiang C, Xie L, Qin X, Zhang Y, Li J, Sun N, Tang G, Wang X, Wang H, Huo Y, Cheng X; Precision Folic Acid Trial to lower homocysteine (PFAT-Hcy) Trial Investigators.",Eur J Nutr. 2024 Aug;63(5):1513-1528. doi: 10.1007/s00394-024-03344-8. Epub 2024 Mar 13.,Huang X,Eur J Nutr,2024,2024/03/13,PMC11329420,,10.1007/s00394-024-03344-8
31929371,Homocysteine and IgA nephropathy: observational and Mendelian randomization analyses,"Zhang YM, Zhou XJ, Shi SF, Liu LJ, Lyu JC, Zhang H.",Chin Med J (Engl). 2020 Feb 5;133(3):277-284. doi: 10.1097/CM9.0000000000000613.,Zhang YM,Chin Med J (Engl),2020,2020/01/14,PMC7004620,,10.1097/CM9.0000000000000613
38996094,"Pre-gestational diabetes mellitus, gestational diabetes mellitus, and its association with the MTHFR C677T polymorphism","Pham NTN, Huynh CTN, Nguyen ATT, Ho CQ, Duong LM, Bui DT, Nguyen HH.",Medicine (Baltimore). 2024 Jul 12;103(28):e38648. doi: 10.1097/MD.0000000000038648.,Pham NTN,Medicine (Baltimore),2024,2024/07/12,PMC11245254,,10.1097/MD.0000000000038648
27614738,Association of the MTHFR Gene C677T Polymorphism with Breast Cancer in a Turkish Population,"Kaya EF, Karakus N, Ulusoy AN, Özaslan C, Kara N.",Oncol Res Treat. 2016;39(9):534-8. doi: 10.1159/000448084. Epub 2016 Aug 18.,Kaya EF,Oncol Res Treat,2016,2016/09/12,,,10.1159/000448084
40158176,Prevalence of MTHFR C677T polymorphism and its association with serum homocysteine and blood pressure among different ethnic groups: insights from a cohort study of Nepal,"Bhatt RD, Karmacharya BM, Shrestha A, Timalsena D, Madhup S, Shahi R, Katuwal N, Shrestha R, Fitzpatrick AL, Risal P.",BMC Cardiovasc Disord. 2025 Mar 29;25(1):235. doi: 10.1186/s12872-025-04690-z.,Bhatt RD,BMC Cardiovasc Disord,2025,2025/03/29,PMC11954282,,10.1186/s12872-025-04690-z
28225483,Homocysteine and all-cause mortality in hypertensive adults without pre-existing cardiovascular conditions: Effect modification by MTHFR C677T polymorphism,"Xu B, Kong X, Xu R, Song Y, Liu L, Zhou Z, Gu R, Shi X, Zhao M, Huang X, He M, Fu J, Cai Y, Li P, Cheng X, Wu C, Chen F, Zhang Y, Tang G, Qin X, Wang B, Xue H, Chen Y, Tian Y, Sun N, Cui Y, Hou FF, Li J, Huo Y.",Medicine (Baltimore). 2017 Feb;96(8):e5862. doi: 10.1097/MD.0000000000005862.,Xu B,Medicine (Baltimore),2017,2017/02/23,PMC5569412,,10.1097/MD.0000000000005862
33833133,"Genetic effect of MTHFR C677T, A1298C, and A1793G polymorphisms on the age at onset, plasma homocysteine, and white matter lesions in Alzheimer's disease in the Chinese population","Jiang Y, Xiao X, Wen Y, Wan M, Zhou L, Liu X, Wang X, Guo L, Liu H, Zhou Y, Wang J, Liao X, Shen L, Jiao B.",Aging (Albany NY). 2021 Apr 4;13(8):11352-11362. doi: 10.18632/aging.202827. Epub 2021 Apr 4.,Jiang Y,Aging (Albany NY),2021,2021/04/09,PMC8109119,,10.18632/aging.202827
36872017,"Infant blood concentrations of folate markers and catabolites are modified by 5,10-methylenetetrahydrofolate reductase C677T genotype and dietary folate source","Obeid R, Warnke I, Wittke A, Bendik I, Troesch B, Schoop R, Hecht C, Demmelmair J, Koletzko B; MEFOLIN Study Group.",Am J Clin Nutr. 2023 Mar;117(3):509-517. doi: 10.1016/j.ajcnut.2022.09.002.,Obeid R,Am J Clin Nutr,2023,2023/03/05,,,10.1016/j.ajcnut.2022.09.002
28360116,Homocysteine and Stroke Risk: Modifying Effect of Methylenetetrahydrofolate Reductase C677T Polymorphism and Folic Acid Intervention,"Zhao M, Wang X, He M, Qin X, Tang G, Huo Y, Li J, Fu J, Huang X, Cheng X, Wang B, Hou FF, Sun N, Cai Y.",Stroke. 2017 May;48(5):1183-1190. doi: 10.1161/STROKEAHA.116.015324. Epub 2017 Mar 30.,Zhao M,Stroke,2017,2017/04/01,,,10.1161/STROKEAHA.116.015324
21123458,MTHFR C677T genotype influences the isotopic enrichment of one-carbon metabolites in folate-compromised men consuming d9-choline,"Yan J, Wang W, Gregory JF 3rd, Malysheva O, Brenna JT, Stabler SP, Allen RH, Caudill MA.",Am J Clin Nutr. 2011 Feb;93(2):348-55. doi: 10.3945/ajcn.110.005975. Epub 2010 Dec 1.,Yan J,Am J Clin Nutr,2011,2010/12/03,PMC3021427,,10.3945/ajcn.110.005975
26266420,"Homocysteine Metabolism Gene Polymorphisms (MTHFR C677T, MTHFR A1298C, MTR A2756G and MTRR A66G) Jointly Elevate the Risk of Folate Deficiency","Li WX, Dai SX, Zheng JJ, Liu JQ, Huang JF.",Nutrients. 2015 Aug 10;7(8):6670-87. doi: 10.3390/nu7085303.,Li WX,Nutrients,2015,2015/08/13,PMC4555142,,10.3390/nu7085303
29245302,MTHFR C677T gene polymorphism and the severity of coronary lesions in acute coronary syndrome,"Li MN, Wang HJ, Zhang NR, Xuan L, Shi XJ, Zhou T, Chen B, Zhang J, Li H.",Medicine (Baltimore). 2017 Dec;96(49):e9044. doi: 10.1097/MD.0000000000009044.,Li MN,Medicine (Baltimore),2017,2017/12/17,PMC5728917,,10.1097/MD.0000000000009044
17164649,"Homocysteine, MTHFR C677 T, vitamin B12, and folate levels in Thai children with ischemic stroke: a case-control study","Sirachainan N, Tapanapruksakul P, Visudtibhan A, Chuansumrit A, Cheeramakara C, Atamasirikul K, Chotsuppakarn S, Areekul S.",J Pediatr Hematol Oncol. 2006 Dec;28(12):803-8. doi: 10.1097/MPH.0b013e31802d3e8a.,Sirachainan N,J Pediatr Hematol Oncol,2006,2006/12/14,,,10.1097/MPH.0b013e31802d3e8a
22230384,MTHFR C677T and MTR A2756G polymorphisms and the homocysteine lowering efficacy of different doses of folic acid in hypertensive Chinese adults,"Qin X, Li J, Cui Y, Liu Z, Zhao Z, Ge J, Guan D, Hu J, Wang Y, Zhang F, Xu X, Wang X, Xu X, Huo Y.",Nutr J. 2012 Jan 10;11:2. doi: 10.1186/1475-2891-11-2.,Qin X,Nutr J,2012,2012/01/11,PMC3274435,,10.1186/1475-2891-11-2
30606816,MTHFR C677T polymorphism increases MTX sensitivity via the inhibition of S-adenosylmethionine and de novo purine synthesis,"Wang YC, Wu MT, Tang FY, Chen DY, Ko HA, Shane B, Huang WN, Chiang EP.",Clin Sci (Lond). 2019 Jan 25;133(2):253-267. doi: 10.1042/CS20180932. Print 2019 Jan 31.,Wang YC,Clin Sci (Lond),2019,2019/01/05,,,10.1042/CS20180932
32019154,Food Intervention with Folate Reduces TNF-α and Interleukin Levels in Overweight and Obese Women with the MTHFR C677T Polymorphism: A Randomized Trial,"Lisboa JVC, Ribeiro MR, Luna RCP, Lima RPA, Nascimento RAFD, Monteiro MGCA, Lima KQF, Fechine CPNDS, Oliveira NFP, Persuhn DC, Veras RC, Gonçalves MDCR, Ferreira FELL, Lima RT, Silva ASD, Diniz ADS, Almeida ATC, Moraes RM, Junior EV, Costa MJC.",Nutrients. 2020 Jan 30;12(2):361. doi: 10.3390/nu12020361.,Lisboa JVC,Nutrients,2020,2020/02/06,PMC7071147,,10.3390/nu12020361
31932513,Interaction of serum vitamin B(12) and folate with MTHFR genotypes on risk of ischemic stroke,"Qin X, Spence JD, Li J, Zhang Y, Li Y, Sun N, Liang M, Song Y, Zhang Y, Wang B, Cheng X, Zhao L, Wang X, Xu X, Huo Y.",Neurology. 2020 Mar 17;94(11):e1126-e1136. doi: 10.1212/WNL.0000000000008932. Epub 2020 Jan 13.,Qin X,Neurology,2020,2020/01/15,PMC7220236,,10.1212/WNL.0000000000008932
15503105,"Plasma homocysteine, MTHFR C677T, CBS 844ins68bp, and MTHFD1 G1958A polymorphisms in spontaneous cervical artery dissections","Konrad C, Müller GA, Langer C, Kuhlenbäumer G, Berger K, Nabavi DG, Dziewas R, Stögbauer F, Ringelstein EB, Junker R.",J Neurol. 2004 Oct;251(10):1242-8. doi: 10.1007/s00415-004-0523-z.,Konrad C,J Neurol,2004,2004/10/27,,,10.1007/s00415-004-0523-z
12560354,Effect of riboflavin status on the homocysteine-lowering effect of folate in relation to the MTHFR (C677T) genotype,"Moat SJ, Ashfield-Watt PA, Powers HJ, Newcombe RG, McDowell IF.",Clin Chem. 2003 Feb;49(2):295-302. doi: 10.1373/49.2.295.,Moat SJ,Clin Chem,2003,2003/02/01,,,10.1373/49.2.295
11721146,"Plasma folate, vitamin B(12), and total homocysteine and homozygosity for the C677T mutation of the 5,10-methylene tetrahydrofolate reductase gene in patients with Alzheimer's dementia. A case-control study","Postiglione A, Milan G, Ruocco A, Gallotta G, Guiotto G, Di Minno G.",Gerontology. 2001 Nov-Dec;47(6):324-9. doi: 10.1159/000052822.,Postiglione A,Gerontology,2001,2001/11/27,,,10.1159/000052822
27379829,One-carbon metabolites and telomere length in a prospective and randomized study of B- and/or D-vitamin supplementation,"Pusceddu I, Herrmann M, Kirsch SH, Werner C, Hübner U, Bodis M, Laufs U, Widmann T, Wagenpfeil S, Geisel J, Herrmann W.",Eur J Nutr. 2017 Aug;56(5):1887-1898. doi: 10.1007/s00394-016-1231-z. Epub 2016 Jul 5.,Pusceddu I,Eur J Nutr,2017,2016/07/06,,,10.1007/s00394-016-1231-z
27035272,"Correlation of clinical response with homocysteine reduction during therapy with reduced B vitamins in patients with MDD who are positive for MTHFR C677T or A1298C polymorphism: a randomized, double-blind, placebo-controlled study","Mech AW, Farah A.",J Clin Psychiatry. 2016 May;77(5):668-71. doi: 10.4088/JCP.15m10166.,Mech AW,J Clin Psychiatry,2016,2016/04/02,,,10.4088/JCP.15m10166
12048292,Homocysteine and folate status in methotrexate-treated patients with rheumatoid arthritis,"van Ede AE, Laan RF, Blom HJ, Boers GH, Haagsma CJ, Thomas CM, De Boo TM, van de Putte LB.",Rheumatology (Oxford). 2002 Jun;41(6):658-65. doi: 10.1093/rheumatology/41.6.658.,van Ede AE,Rheumatology (Oxford),2002,2002/06/06,,,10.1093/rheumatology/41.6.658
19384265,The effects of vitamin supplementation and MTHFR (C677T) genotype on homocysteine-lowering and migraine disability,"Lea R, Colson N, Quinlan S, Macmillan J, Griffiths L.",Pharmacogenet Genomics. 2009 Jun;19(6):422-8. doi: 10.1097/FPC.0b013e32832af5a3.,Lea R,Pharmacogenet Genomics,2009,2009/04/23,,,10.1097/FPC.0b013e32832af5a3
23698160,Homocysteine lowering by folate-rich diet or pharmacological supplementations in subjects with moderate hyperhomocysteinemia,"Zappacosta B, Mastroiacovo P, Persichilli S, Pounis G, Ruggeri S, Minucci A, Carnovale E, Andria G, Ricci R, Scala I, Genovese O, Turrini A, Mistura L, Giardina B, Iacoviello L.",Nutrients. 2013 May 8;5(5):1531-43. doi: 10.3390/nu5051531.,Zappacosta B,Nutrients,2013,2013/05/24,PMC3708334,,10.3390/nu5051531
22219102,Impact of MTHFR C677T gene polymorphism and vitamins intake on homocysteine concentration in the Polish adult population,"Waśkiewicz A, Piotrowski W, Broda G, Sobczyk-Kopcioł A, Płoski R.",Kardiol Pol. 2011;69(12):1259-64.,Waśkiewicz A,Kardiol Pol,2011,2012/01/06,,,
34348647,"The prevalence, relative risk factors and MTHFR C677T genotype of H type hypertension of the elderly hypertensives in Shanghai, China: a cross-section study : Prevalence of H type hypertension","Qian XL, Cao H, Zhang J, Gu ZH, Tang WQ, Shen L, Hu JL, Yao ZF, Zhang L, Tang MN, Lv XC, Zhou J, Jin XJ, Hong B, Cui ZQ, Ge JB.",BMC Cardiovasc Disord. 2021 Aug 4;21(1):376. doi: 10.1186/s12872-021-02151-x.,Qian XL,BMC Cardiovasc Disord,2021,2021/08/05,PMC8336333,,10.1186/s12872-021-02151-x
23430981,"Haplotype analysis of the folate-related genes MTHFR, MTRR, and MTR and migraine with aura","Roecklein KA, Scher AI, Smith A, Harris T, Eiriksdottir G, Garcia M, Gudnason V, Launer LJ.",Cephalalgia. 2013 May;33(7):469-82. doi: 10.1177/0333102413477738. Epub 2013 Feb 19.,Roecklein KA,Cephalalgia,2013,2013/02/23,PMC4231882,NIHMS639154,10.1177/0333102413477738
11532106,"An MTHFR variant, homocysteine, and cardiovascular comorbidity in renal disease","Wrone EM, Zehnder JL, Hornberger JM, McCann LM, Coplon NS, Fortmann SP.",Kidney Int. 2001 Sep;60(3):1106-13. doi: 10.1046/j.1523-1755.2001.0600031106.x.,Wrone EM,Kidney Int,2001,2001/09/05,,,10.1046/j.1523-1755.2001.0600031106.x
25598270,Effects of dietary folate intake on migraine disability and frequency,"Menon S, Lea RA, Ingle S, Sutherland M, Wee S, Haupt LM, Palmer M, Griffiths LR.",Headache. 2015 Feb;55(2):301-9. doi: 10.1111/head.12490. Epub 2015 Jan 19.,Menon S,Headache,2015,2015/01/20,,,10.1111/head.12490
19825913,Hyperhomocysteinemia and C677T MTHFR genotype in patients with retinal vein thrombosis,"Sottilotta G, Siboni SM, Latella C, Oriana V, Romeo E, Santoro R, Consonni D, Trapani Lombardo V.",Clin Appl Thromb Hemost. 2010 Oct;16(5):549-53. doi: 10.1177/1076029609348644. Epub 2009 Oct 13.,Sottilotta G,Clin Appl Thromb Hemost,2010,2009/10/15,,,10.1177/1076029609348644
15935452,Gene--nutrition interactions in coronary artery disease: correlation between the MTHFR C677T polymorphism and folate and homocysteine status in a Korean population,"Huh HJ, Chi HS, Shim EH, Jang S, Park CJ.",Thromb Res. 2006;117(5):501-6. doi: 10.1016/j.thromres.2005.04.009. Epub 2005 Jun 1.,Huh HJ,Thromb Res,2006,2005/06/07,,,10.1016/j.thromres.2005.04.009
32992197,Homocysteinemia is Associated with the Presence of Microbleeds in Cognitively Impaired Patients,"Yoo JS, Ryu CH, Kim YS, Kim HJ, Bushnell CD, Kim HY.",J Stroke Cerebrovasc Dis. 2020 Dec;29(12):105302. doi: 10.1016/j.jstrokecerebrovasdis.2020.105302. Epub 2020 Sep 18.,Yoo JS,J Stroke Cerebrovasc Dis,2020,2020/09/29,,,10.1016/j.jstrokecerebrovasdis.2020.105302
32318793,Combined effect of polymorphisms of MTHFR and MTR and arsenic methylation capacity on developmental delay in preschool children in Taiwan,"Hsueh YM, Lin YC, Chung CJ, Huang YL, Hsieh RL, Huang PT, Wu MY, Shiue HS, Chien SN, Lee CY, Lin MI, Mu SC, Su CT.",Arch Toxicol. 2020 Jun;94(6):2027-2038. doi: 10.1007/s00204-020-02745-y. Epub 2020 Apr 21.,Hsueh YM,Arch Toxicol,2020,2020/04/23,,,10.1007/s00204-020-02745-y
27316508,Methylenetetrahydrofolate reductase C677T and methionine synthase A2756G gene polymorphisms and associated risk of cardiovascular diseases: A study from Jammu region,"Raina JK, Sharma M, Panjaliya RK, Bhagat M, Sharma R, Bakaya A, Kumar P.",Indian Heart J. 2016 May-Jun;68(3):421-30. doi: 10.1016/j.ihj.2016.02.009. Epub 2016 Apr 20.,Raina JK,Indian Heart J,2016,2016/06/19,PMC4912384,,10.1016/j.ihj.2016.02.009
26559681,The C677T MTHFR genotypes influence the efficacy of B9 and B12 vitamins supplementation to lowering plasma total homocysteine in hemodialysis,"Achour O, Elmtaoua S, Zellama D, Omezzine A, Moussa A, Rejeb J, Boumaiza I, Bouacida L, Rejeb NB, Achour A, Bouslama A.",J Nephrol. 2016 Oct;29(5):691-8. doi: 10.1007/s40620-015-0235-8. Epub 2015 Nov 11.,Achour O,J Nephrol,2016,2015/11/13,,,10.1007/s40620-015-0235-8
16268464,"Association of MTRRA66G polymorphism (but not of MTHFR C677T and A1298C, MTRA2756G, TCN C776G) with homocysteine and coronary artery disease in the French population","Guéant-Rodriguez RM, Juilliére Y, Candito M, Adjalla CE, Gibelin P, Herbeth B, Van Obberghen E, Gueánt JL.",Thromb Haemost. 2005 Sep;94(3):510-5. doi: 10.1160/TH05-04-0262.,Guéant-Rodriguez RM,Thromb Haemost,2005,2005/11/05,,,10.1160/TH05-04-0262
32758174,Association of MTHFR C677T polymorphism with severity and localization of chronic atrophic gastritis patients without Helicobacter pylori infection: a case control study,"Kong S, Ye F, Dang Y, Hua Y, Zhang G.",BMC Cancer. 2020 Aug 5;20(1):725. doi: 10.1186/s12885-020-07208-2.,Kong S,BMC Cancer,2020,2020/08/08,PMC7405366,,10.1186/s12885-020-07208-2
15777680,Are effects of MTHFR (C677T) genotype on BMD confined to women with low folate and riboflavin intake? Analysis of food records from the Danish osteoporosis prevention study,"Abrahamsen B, Madsen JS, Tofteng CL, Stilgren L, Bladbjerg EM, Kristensen SR, Brixen K, Mosekilde L.",Bone. 2005 Mar;36(3):577-83. doi: 10.1016/j.bone.2004.12.014.,Abrahamsen B,Bone,2005,2005/03/22,,,10.1016/j.bone.2004.12.014
12747601,"Homocysteine, methylenetetrahydrofolate reductase C677T polymorphism and the B-vitamins: a facet of nature-nurture interplay","Herrmann W, Obeid R, Schorr H, Zarzour W, Geisel J.",Clin Chem Lab Med. 2003 Apr;41(4):547-53. doi: 10.1515/CCLM.2003.083.,Herrmann W,Clin Chem Lab Med,2003,2003/05/16,,,10.1515/CCLM.2003.083
11738277,"Optimization of dietary folate or low-dose folic acid supplements lower homocysteine but do not enhance endothelial function in healthy adults, irrespective of the methylenetetrahydrofolate reductase (C677T) genotype","Pullin CH, Ashfield-Watt PA, Burr ML, Clark ZE, Lewis MJ, Moat SJ, Newcombe RG, Powers HJ, Whiting JM, McDowell IF.",J Am Coll Cardiol. 2001 Dec;38(7):1799-805. doi: 10.1016/s0735-1097(01)01668-0.,Pullin CH,J Am Coll Cardiol,2001,2001/12/12,,,10.1016/s0735-1097(01)01668-0
16774768,"Homocysteine serum levels and MTHFR C677T genotype in patients with Parkinson's disease, with and without levodopa therapy","Todorović Z, Dzoljić E, Novaković I, Mirković D, Stojanović R, Nesić Z, Krajinović M, Prostran M, Kostić V.",J Neurol Sci. 2006 Oct 25;248(1-2):56-61. doi: 10.1016/j.jns.2006.05.040. Epub 2006 Jun 13.,Todorović Z,J Neurol Sci,2006,2006/06/16,,,10.1016/j.jns.2006.05.040
24793554,Comparison of homocysteinemia and MTHFR 677CT polymorphism with Framingham Coronary Heart Risk Score,"Gariglio L, Riviere S, Morales A, Porcile R, Potenzoni M, Fridman O.",Arch Cardiol Mex. 2014 Apr-Jun;84(2):71-8. doi: 10.1016/j.acmx.2013.12.006. Epub 2014 May 1.,Gariglio L,Arch Cardiol Mex,2014,2014/05/06,,,10.1016/j.acmx.2013.12.006
23959833,"5,10-Methylenetetrahydrofolate reductase (MTHFR), methionine synthase (MTRR), and methionine synthase reductase (MTR) gene polymorphisms and adult meningioma risk","Zhang J, Zhou YW, Shi HP, Wang YZ, Li GL, Yu HT, Xie XY.",J Neurooncol. 2013 Nov;115(2):233-9. doi: 10.1007/s11060-013-1218-z.,Zhang J,J Neurooncol,2013,2013/08/21,,,10.1007/s11060-013-1218-z
27626182,Predictive value of homocysteine for depression after acute coronary syndrome,"Kang HJ, Stewart R, Bae KY, Kim SW, Shin IS, Kang H, Moon WJ, Hong YJ, Ahn Y, Jeong MH, Yoon JS, Kim JM.",Oncotarget. 2016 Oct 18;7(42):69032-69040. doi: 10.18632/oncotarget.11966.,Kang HJ,Oncotarget,2016,2016/09/15,PMC5356609,,10.18632/oncotarget.11966
23787444,Maternal C677T MTHFR polymorphism and environmental factors are associated with cleft lip and palate in a Mexican population,"Ibarra-Lopez JJ, Duarte P, Antonio-Vejar V, Calderon-Aranda ES, Huerta-Beristain G, Flores-Alfaro E, Moreno-Godinez ME.",J Investig Med. 2013 Aug;61(6):1030-5. doi: 10.2310/JIM.0b013e31829a7e7e.,Ibarra-Lopez JJ,J Investig Med,2013,2013/06/22,,,10.2310/JIM.0b013e31829a7e7e
28004270,Determinants of folate and vitamin B12 plasma levels in the French E3N-EPIC cohort,"de Batlle J, Matejcic M, Chajes V, Moreno-Macias H, Amadou A, Slimani N, Cox DG, Clavel-Chapelon F, Fagherazzi G, Romieu I.",Eur J Nutr. 2018 Mar;57(2):751-760. doi: 10.1007/s00394-016-1365-z. Epub 2016 Dec 21.,de Batlle J,Eur J Nutr,2018,2016/12/23,,,10.1007/s00394-016-1365-z
38876040,"Betaine supplementation modulates betaine concentration by methylenetetrahydrofolate reductase genotype, but has no effect on amino acid profile in healthy active males: A randomized placebo-controlled cross-over study","Zawieja E, Drabińska N, Jeleń H, Szwengiel A, Durkalec-Michalski K, Chmurzynska A.",Nutr Res. 2024 Jul;127:63-74. doi: 10.1016/j.nutres.2024.05.003. Epub 2024 May 23.,Zawieja E,Nutr Res,2024,2024/06/14,,,10.1016/j.nutres.2024.05.003
37409757,"Betaine supplementation improves CrossFit performance and increases testosterone levels, but has no influence on Wingate power: randomized crossover trial","Zawieja E, Durkalec-Michalski K, Sadowski M, Główka N, Chmurzynska A.",J Int Soc Sports Nutr. 2023 Dec;20(1):2231411. doi: 10.1080/15502783.2023.2231411.,Zawieja E,J Int Soc Sports Nutr,2023,2023/07/06,PMC10327519,,10.1080/15502783.2023.2231411
20298385,Lack of association between the MTHFR (C677T) polymorphism and atopic disease,"Thuesen BH, Husemoen LL, Fenger M, Linneberg A.",Clin Respir J. 2009 Apr;3(2):102-8. doi: 10.1111/j.1752-699X.2009.00128.x.,Thuesen BH,Clin Respir J,2009,2010/03/20,,,10.1111/j.1752-699X.2009.00128.x
25012419,The one-carbon-cycle and methylenetetrahydrofolate reductase (MTHFR) C677T polymorphism in recurrent major depressive disorder; influence of antidepressant use and depressive state?,"Lok A, Mocking RJ, Assies J, Koeter MW, Bockting CL, de Vries GJ, Visser I, Derks EM, Kayser M, Schene AH.",J Affect Disord. 2014 Sep;166:115-23. doi: 10.1016/j.jad.2014.04.048. Epub 2014 Apr 30.,Lok A,J Affect Disord,2014,2014/07/12,,,10.1016/j.jad.2014.04.048
19272686,Effect of the MTHFR C677T and A1298C polymorphisms on survival in patients with advanced CKD and ESRD: a prospective study,"Jamison RL, Shih MC, Humphries DE, Guarino PD, Kaufman JS, Goldfarb DS, Warren SR, Gaziano JM, Lavori P; Veterans Affairs Site Investigators.",Am J Kidney Dis. 2009 May;53(5):779-89. doi: 10.1053/j.ajkd.2008.12.023. Epub 2009 Mar 9.,Jamison RL,Am J Kidney Dis,2009,2009/03/11,,,10.1053/j.ajkd.2008.12.023
26438060,"Polymorphisms of 5,10-methylenetetrahydrofolate reductase and thymidylate synthase, dietary folate intake, and the risk of leukemia in adults","Liu P, Zhang M, Xie X, Jin J, Holman CD.",Tumour Biol. 2016 Mar;37(3):3265-75. doi: 10.1007/s13277-015-4168-6. Epub 2015 Oct 5.,Liu P,Tumour Biol,2016,2015/10/07,,,10.1007/s13277-015-4168-6
18945219,MTHFR C677T polymorphism and risk of HCC in patients with liver cirrhosis: role of male gender and alcohol consumption,"Fabris C, Toniutto P, Falleti E, Fontanini E, Cussigh A, Bitetto D, Fornasiere E, Fumolo E, Avellini C, Minisini R, Pirisi M.",Alcohol Clin Exp Res. 2009 Jan;33(1):102-7. doi: 10.1111/j.1530-0277.2008.00816.x. Epub 2008 Oct 18.,Fabris C,Alcohol Clin Exp Res,2009,2008/10/24,,,10.1111/j.1530-0277.2008.00816.x
17488658,Methylenetetrahydrofolate reductase C677T and A1298C gene variants in adult non-Hodgkin's lymphoma patients: association with toxicity and survival,"Gemmati D, Ongaro A, Tognazzo S, Catozzi L, Federici F, Mauro E, Della Porta M, Campioni D, Bardi A, Gilli G, Pellati A, Caruso A, Scapoli GL, De Mattei M.",Haematologica. 2007 Apr;92(4):478-85. doi: 10.3324/haematol.10587.,Gemmati D,Haematologica,2007,2007/05/10,,,10.3324/haematol.10587
12705333,"Association between 5,10-methylenetetrahydrofolate reductase C677T and A1298C polymorphisms and conotruncal heart defects","Storti S, Vittorini S, Iascone MR, Sacchelli M, Collavoli A, Ripoli A, Cocchi G, Biagini A, Clerico A.",Clin Chem Lab Med. 2003 Mar;41(3):276-80. doi: 10.1515/CCLM.2003.043.,Storti S,Clin Chem Lab Med,2003,2003/04/23,,,10.1515/CCLM.2003.043
26879531,Interaction between MTHFR 677C>T and periconceptional folic acid supplementation in the risk of Hypospadias,"Dokter EM, van Rooij IA, Wijers CH, Groothuismink JM, van der Biezen JJ, Feitz WF, Roeleveld N, van der Zanden LF.",Birth Defects Res A Clin Mol Teratol. 2016 Apr;106(4):275-84. doi: 10.1002/bdra.23487. Epub 2016 Feb 16.,Dokter EM,Birth Defects Res A Clin Mol Teratol,2016,2016/02/17,,,10.1002/bdra.23487
17551576,"Role of C677T and A1298C MTHFR, A2756G MTR and -786 C/T eNOS gene polymorphisms in atrial fibrillation susceptibility","Giusti B, Gori AM, Marcucci R, Sestini I, Saracini C, Sticchi E, Gensini F, Fatini C, Abbate R, Gensini GF.",PLoS One. 2007 Jun 6;2(6):e495. doi: 10.1371/journal.pone.0000495.,Giusti B,PLoS One,2007,2007/06/07,PMC1876814,,10.1371/journal.pone.0000495
28397471,"Interactions of Methylenetetrahydrofolate Reductase Gene Polymorphisms, Folate, and Homocysteine on Blood Pressure in a Chinese Hypertensive Population","Li WX, Liao P, Hu CY, Cheng F, Zhang T, Sun YY, Tang L, Wang MM, Liu KS, Liu D, Liu F.",Clin Lab. 2017 Apr 1;63(4):817-825. doi: 10.7754/Clin.Lab.2016.160918.,Li WX,Clin Lab,2017,2017/04/12,,,10.7754/Clin.Lab.2016.160918
22052259,"MTHFR polymorphisms, folate intake and carcinogen DNA adducts in the lung","Lee MS, Asomaning K, Su L, Wain JC, Mark EJ, Christiani DC.",Int J Cancer. 2012 Sep 1;131(5):1203-9. doi: 10.1002/ijc.27338. Epub 2012 Jan 11.,Lee MS,Int J Cancer,2012,2011/11/05,PMC3293105,NIHMS336923,10.1002/ijc.27338
29911750,Use of MTHFR C677T polymorphism and plasma pharmacokinetics to predict methotrexate toxicity in patients with acute lymphoblastic leukemia,"Mahmoud LB, Mdhaffar M, Frikha R, Ghozzi H, Hakim A, Sahnoun Z, Elloumi M, Zeghal K.",Adv Clin Exp Med. 2018 Aug;27(8):1061-1068. doi: 10.17219/acem/69802.,Mahmoud LB,Adv Clin Exp Med,2018,2018/06/19,,,10.17219/acem/69802
