PMID,Title,Authors,Citation,First Author,Journal/Book,Publication Year,Create Date,PMCID,NIHMS ID,DOI
11739968,Cerebrovascular events in patients with significant stenosis of the carotid artery are associated with hyperhomocysteinemia and platelet antigen-1 (Leu33Pro) polymorphism,"Streifler JY, Rosenberg N, Chetrit A, Eskaraev R, Sela BA, Dardik R, Zivelin A, Ravid B, Davidson J, Seligsohn U, Inbal A.",Stroke. 2001 Dec 1;32(12):2753-8. doi: 10.1161/hs1201.099650.,Streifler JY,Stroke,2001,2001/12/12,,,10.1161/hs1201.099650
14716779,Genetic polymorphisms in the Hmong population: implications for cancer etiology and survival,"Kiffmeyer WR, Langer E, Davies SM, Envall J, Robison LL, Ross JA.",Cancer. 2004 Jan 15;100(2):411-7. doi: 10.1002/cncr.11913.,Kiffmeyer WR,Cancer,2004,2004/01/13,,,10.1002/cncr.11913
15354385,"MTHFR C677T polymorphism, folic acid and hyperhomocysteinemia in levodopa treated patients with Parkinson's disease","Woitalla D, Kuhn W, Müller T.",J Neural Transm Suppl. 2004;(68):15-20. doi: 10.1007/978-3-7091-0579-5_2.,Woitalla D,J Neural Transm Suppl,2004,2004/09/10,,,10.1007/978-3-7091-0579-5_2
12356186,"Methylenetetrahydrofolate reductase gene polymorphism, hyperhomocysteinemia and occlusive retinal vascular disease in type 2 diabetic and non-diabetic subjects","Wirta V, Saransaari P, Wirta O, Rantalaiho V, Oja SS, Pasternack A, Koivula T, Lehtimäki T.",Clin Nephrol. 2002 Sep;58(3):171-8. doi: 10.5414/cnp58171.,Wirta V,Clin Nephrol,2002,2002/10/03,,,10.5414/cnp58171
18595133,Methylenetetrahydrofolate reductase C677T genotype affects promoter methylation of tumor-specific genes in sporadic colorectal cancer through an interaction with folate/vitamin B12 status,"Mokarram P, Naghibalhossaini F, Saberi Firoozi M, Hosseini SV, Izadpanah A, Salahi H, Malek-Hosseini SA, Talei A, Mojallal M.",World J Gastroenterol. 2008 Jun 21;14(23):3662-71. doi: 10.3748/wjg.14.3662.,Mokarram P,World J Gastroenterol,2008,2008/07/03,PMC2719229,,10.3748/wjg.14.3662
17546637,Polymorphisms involved in the folate metabolizing pathway and risk of multiple myeloma,"Kim HN, Kim YK, Lee IK, Lee JJ, Yang DH, Park KS, Choi JS, Park MR, Jo DY, Kim HJ.",Am J Hematol. 2007 Sep;82(9):798-801. doi: 10.1002/ajh.20967.,Kim HN,Am J Hematol,2007,2007/06/05,,,10.1002/ajh.20967
14727014,Evidence for an association of methylene tetrahydrofolate reductase polymorphism C677T and an increased risk of fractures: results from a population-based Danish twin study,"Bathum L, von Bornemann Hjelmborg J, Christiansen L, Madsen JS, Skytthe A, Christensen K.",Osteoporos Int. 2004 Aug;15(8):659-64. doi: 10.1007/s00198-003-1584-z. Epub 2004 Jan 16.,Bathum L,Osteoporos Int,2004,2004/01/17,,,10.1007/s00198-003-1584-z
12204804,Effects of serum B vitamins on elevated plasma homocysteine levels associated with the mutation of methylenetetrahydrofolate reductase gene in Japanese,"Moriyama Y, Okamura T, Kajinami K, Iso H, Inazu A, Kawashiri M, Mizuno M, Takeda Y, Sakamoto Y, Kimura H, Suzuki H, Mabuchi H.",Atherosclerosis. 2002 Oct;164(2):321-8. doi: 10.1016/s0021-9150(02)00105-3.,Moriyama Y,Atherosclerosis,2002,2002/09/03,,,10.1016/s0021-9150(02)00105-3
15950563,"Family history, plasma homocysteine, and age at onset of symptoms of myocardial ischemia in patients with different methylenetetrahydrofolate reductase genotypes","Mager A, Koren-Morag N, Shohat M, Harell D, Battler A.",Am J Cardiol. 2005 Jun 15;95(12):1420-4. doi: 10.1016/j.amjcard.2005.01.097.,Mager A,Am J Cardiol,2005,2005/06/14,,,10.1016/j.amjcard.2005.01.097
12689917,Genetic evidence that nitric oxide modulates homocysteine: the NOS3 894TT genotype is a risk factor for hyperhomocystenemia,"Brown KS, Kluijtmans LA, Young IS, Woodside J, Yarnell JW, McMaster D, Murray L, Evans AE, Boreham CA, McNulty H, Strain JJ, Mitchell LE, Whitehead AS.",Arterioscler Thromb Vasc Biol. 2003 Jun 1;23(6):1014-20. doi: 10.1161/01.ATV.0000071348.70527.F4. Epub 2003 Apr 10.,Brown KS,Arterioscler Thromb Vasc Biol,2003,2003/04/12,,,10.1161/01.ATV.0000071348.70527.F4
11207634,Determinants of changes in plasma homocysteine in hyperthyroidism and hypothyroidism,"Diekman MJ, van der Put NM, Blom HJ, Tijssen JG, Wiersinga WM.",Clin Endocrinol (Oxf). 2001 Feb;54(2):197-204. doi: 10.1046/j.1365-2265.2001.01170.x.,Diekman MJ,Clin Endocrinol (Oxf),2001,2001/02/24,,,10.1046/j.1365-2265.2001.01170.x
18328637,Protective effect against alcohol dependence of the thermolabile variant of MTHFR,"Saffroy R, Benyamina A, Pham P, Marill C, Karila L, Reffas M, Debuire B, Reynaud M, Lemoine A.",Drug Alcohol Depend. 2008 Jul 1;96(1-2):30-6. doi: 10.1016/j.drugalcdep.2008.01.016. Epub 2008 Mar 7.,Saffroy R,Drug Alcohol Depend,2008,2008/03/11,,,10.1016/j.drugalcdep.2008.01.016
15387863,Association of pre-eclampsia with hyperhomocysteinaemia and methylenetetrahydrofolate reductase gene C677T polymorphism in a Turkish population,"Yilmaz H, Unlüçerçi Y, Gürdöl F, Isbilen E, Isbir T.",Aust N Z J Obstet Gynaecol. 2004 Oct;44(5):423-7. doi: 10.1111/j.1479-828X.2004.00283.x.,Yilmaz H,Aust N Z J Obstet Gynaecol,2004,2004/09/25,,,10.1111/j.1479-828X.2004.00283.x
10926884,Riboflavin as a determinant of plasma total homocysteine: effect modification by the methylenetetrahydrofolate reductase C677T polymorphism,"Hustad S, Ueland PM, Vollset SE, Zhang Y, Bjørke-Monsen AL, Schneede J.",Clin Chem. 2000 Aug;46(8 Pt 1):1065-71.,Hustad S,Clin Chem,2000,2000/08/06,,,
16142884,Influence of methylenetetrahydrofolate reductase polymorphisms on efficacy and toxicity of methotrexate in patients with juvenile idiopathic arthritis,"Schmeling H, Biber D, Heins S, Horneff G.",J Rheumatol. 2005 Sep;32(9):1832-6.,Schmeling H,J Rheumatol,2005,2005/09/06,,,
18160726,"Influence of 5,10-methylenetetrahydrofolate reductase polymorphism on whole-blood folate concentrations measured by LC-MS/MS, microbiologic assay, and bio-rad radioassay","Fazili Z, Pfeiffer CM, Zhang M, Jain RB, Koontz D.",Clin Chem. 2008 Jan;54(1):197-201. doi: 10.1373/clinchem.2007.096545.,Fazili Z,Clin Chem,2008,2007/12/28,,,10.1373/clinchem.2007.096545
15607533,Methylenetetrahydrofolate reductase polymorphism associated with susceptibility to coronary heart disease in Chinese type 2 diabetic patients,"Sun J, Xu Y, Xue J, Zhu Y, Lu H.",Mol Cell Endocrinol. 2005 Jan 14;229(1-2):95-101. doi: 10.1016/j.mce.2004.09.003.,Sun J,Mol Cell Endocrinol,2005,2004/12/21,,,10.1016/j.mce.2004.09.003
18199722,Dietary vitamin B6 intake and the risk of colorectal cancer,"Theodoratou E, Farrington SM, Tenesa A, McNeill G, Cetnarskyj R, Barnetson RA, Porteous ME, Dunlop MG, Campbell H.",Cancer Epidemiol Biomarkers Prev. 2008 Jan;17(1):171-82. doi: 10.1158/1055-9965.EPI-07-0621.,Theodoratou E,Cancer Epidemiol Biomarkers Prev,2008,2008/01/18,,,10.1158/1055-9965.EPI-07-0621
12370840,Post-methionine-load hyperhomocysteinemia and increased lipoprotein(a) are associated with renal metabolic dysfunction: a hypothesis,"Herrmann W, Stanger O, Knapp JP, Semmelrock HJ, Lemmerer M, Rigler B.",Metabolism. 2002 Oct;51(10):1235-40. doi: 10.1053/meta.2002.35179.,Herrmann W,Metabolism,2002,2002/10/09,,,10.1053/meta.2002.35179
16704755,"Hyperhomocysteinaemia, methylenetetrahydrofolate reductase polymorphism and risk of coronary artery disease","Kerkeni M, Addad F, Chauffert M, Myara A, Gerhardt M, Chevenne D, Trivin F, Farhat MB, Miled A, Maaroufi K.",Ann Clin Biochem. 2006 May;43(Pt 3):200-6. doi: 10.1258/000456306776865232.,Kerkeni M,Ann Clin Biochem,2006,2006/05/18,,,10.1258/000456306776865232
15895286,"Assessment of tailor-made prevention of atherosclerosis with folic acid supplementation: randomized, double-blind, placebo-controlled trials in each MTHFR C677T genotype","Miyaki K, Murata M, Kikuchi H, Takei I, Nakayama T, Watanabe K, Omae K.",J Hum Genet. 2005;50(5):241-248. doi: 10.1007/s10038-005-0247-7. Epub 2005 May 14.,Miyaki K,J Hum Genet,2005,2005/05/17,,,10.1007/s10038-005-0247-7
15159311,Common gene polymorphisms in the metabolic folate and methylation pathway and the risk of acute lymphoblastic leukemia and non-Hodgkin's lymphoma in adults,"Gemmati D, Ongaro A, Scapoli GL, Della Porta M, Tognazzo S, Serino ML, Di Bona E, Rodeghiero F, Gilli G, Reverberi R, Caruso A, Pasello M, Pellati A, De Mattei M.",Cancer Epidemiol Biomarkers Prev. 2004 May;13(5):787-94.,Gemmati D,Cancer Epidemiol Biomarkers Prev,2004,2004/05/26,,,
18495456,Choline status is not a reliable indicator of moderate changes in dietary choline consumption in premenopausal women,"Abratte CM, Wang W, Li R, Axume J, Moriarty DJ, Caudill MA.",J Nutr Biochem. 2009 Jan;20(1):62-9. doi: 10.1016/j.jnutbio.2007.12.002. Epub 2008 May 20.,Abratte CM,J Nutr Biochem,2009,2008/05/23,,,10.1016/j.jnutbio.2007.12.002
12039122,The C677T polymorphism of the methylenetetrahydrofolate reductase gene and idiopathic recurrent miscarriage,"Unfried G, Griesmacher A, Weismüller W, Nagele F, Huber JC, Tempfer CB.",Obstet Gynecol. 2002 Apr;99(4):614-9. doi: 10.1016/s0029-7844(01)01789-6.,Unfried G,Obstet Gynecol,2002,2002/06/01,,,10.1016/s0029-7844(01)01789-6
15110890,Reduced breast cancer risk with increasing serum folate in a case-control study of the C677T genotype of the methylenetetrahydrofolate reductase gene,"Beilby J, Ingram D, Hähnel R, Rossi E.",Eur J Cancer. 2004 May;40(8):1250-4. doi: 10.1016/j.ejca.2004.01.026.,Beilby J,Eur J Cancer,2004,2004/04/28,,,10.1016/j.ejca.2004.01.026
18591889,Menopause modulates homocysteine levels in diabetic and non-diabetic women,"Russo GT, Di Benedetto A, Alessi E, Giandalia A, Gaudio A, Ientile R, Horvath KV, Asztalos B, Raimondo G, Cucinotta D.",J Endocrinol Invest. 2008 Jun;31(6):546-51. doi: 10.1007/BF03346406.,Russo GT,J Endocrinol Invest,2008,2008/07/02,,,10.1007/BF03346406
15479893,Thrombophilic factors are not the leading cause of thrombosis in Behçet's disease,"Leiba M, Seligsohn U, Sidi Y, Harats D, Sela BA, Griffin JH, Livneh A, Rosenberg N, Gelernter I, Gur H, Ehrenfeld M.",Ann Rheum Dis. 2004 Nov;63(11):1445-9. doi: 10.1136/ard.2003.014241.,Leiba M,Ann Rheum Dis,2004,2004/10/14,PMC1754810,,10.1136/ard.2003.014241
15785306,The relationships between plasma total homocysteine and selected atherosclerotic risk factors according to the C677T methylenetetrahydrofolate reductase gene in Japanese,"Lwin H, Yoshiike N, Yokoyama T, Saito K, Date C, Tanaka H.",Eur J Cardiovasc Prev Rehabil. 2005 Apr;12(2):182-4. doi: 10.1097/01.hjr.0000161441.03927.31.,Lwin H,Eur J Cardiovasc Prev Rehabil,2005,2005/03/24,,,10.1097/01.hjr.0000161441.03927.31
16987799,Association of the methylenetetrahydrofolate reductase A1298C but not the C677T single nucleotide polymorphism with sickle cell disease in Bahrain,"Al-Absi IK, Al-Subaie AM, Ameen G, Mahdi N, Mohammad AM, Fawaz NA, Almawi WY.",Hemoglobin. 2006;30(4):449-53. doi: 10.1080/03630260600867958.,Al-Absi IK,Hemoglobin,2006,2006/09/22,,,10.1080/03630260600867958
20881312,Superficial thrombophlebitis in varicose vein disease: the particular role of methylenetetrahydrofolate reductase,"Wilmanns C, Casey A, Schinzel H, Walter PK.",Phlebology. 2011 Jun;26(4):135-9. doi: 10.1258/phleb.2009.009075. Epub 2010 Sep 29.,Wilmanns C,Phlebology,2011,2010/10/01,,,10.1258/phleb.2009.009075
29030456,Association between percent decline in serum total homocysteine and risk of first stroke,"Huang X, Li Y, Li P, Li J, Bao H, Zhang Y, Wang B, Sun N, Wang J, He M, Yin D, Tang G, Chen Y, Cui Y, Huang Y, Hou FF, Qin X, Huo Y, Cheng X.",Neurology. 2017 Nov 14;89(20):2101-2107. doi: 10.1212/WNL.0000000000004648. Epub 2017 Oct 13.,Huang X,Neurology,2017,2017/10/15,,,10.1212/WNL.0000000000004648
23328702,Short-term folate supplementation in physiological doses has no effect on ESR1 and MLH1 methylation in colonic mucosa of individuals with adenoma,"Al-Ghnaniem Abbadi R, Emery P, Pufulete M.",J Nutrigenet Nutrigenomics. 2012;5(6):327-38. doi: 10.1159/000345819. Epub 2013 Jan 16.,Al-Ghnaniem Abbadi R,J Nutrigenet Nutrigenomics,2012,2013/01/19,,,10.1159/000345819
15525878,C677T methylene-tetrahydrofolate reductase mutation in type 2 diabetic patients with and without hyperhomocysteinaemia,"Buysschaert M, Gala JL, Bessomo A, Hermans MP.",Diabetes Metab. 2004 Sep;30(4):349-54. doi: 10.1016/s1262-3636(07)70127-1.,Buysschaert M,Diabetes Metab,2004,2004/11/05,,,10.1016/s1262-3636(07)70127-1
10704624,"Polygenic influence on plasma homocysteine: association of two prevalent mutations, the 844ins68 of cystathionine beta-synthase and A(2756)G of methionine synthase, with lowered plasma homocysteine levels","Tsai MY, Bignell M, Yang F, Welge BG, Graham KJ, Hanson NQ.",Atherosclerosis. 2000 Mar;149(1):131-7. doi: 10.1016/s0021-9150(99)00297-x.,Tsai MY,Atherosclerosis,2000,2000/03/08,,,10.1016/s0021-9150(99)00297-x
17709451,Folic acid and vitamin B-12 supplementation does not favorably influence uracil incorporation and promoter methylation in rectal mucosa DNA of subjects with previous colorectal adenomas,"van den Donk M, Pellis L, Crott JW, van Engeland M, Friederich P, Nagengast FM, van Bergeijk JD, de Boer SY, Mason JB, Kok FJ, Keijer J, Kampman E.",J Nutr. 2007 Sep;137(9):2114-20. doi: 10.1093/jn/137.9.2114.,van den Donk M,J Nutr,2007,2007/08/22,,,10.1093/jn/137.9.2114
18075008,Sex-specific effect of the thermolabile C677T mutation in the methylenetetrahydrofolate reductase gene on angiographically assessed coronary artery disease in Brazilians,"Rios DL, D'Onofrio LO, Carvalho HG, Santos-Filho A, Galvão-Castro B.",Hum Biol. 2007 Aug;79(4):453-61. doi: 10.1353/hub.2007.0053.,Rios DL,Hum Biol,2007,2007/12/14,,,10.1353/hub.2007.0053
19125845,Hyperhomocysteinemia in patients with epilepsy: does it play a role in the pathogenesis of brain atrophy? A preliminary report,"Gorgone G, Caccamo D, Pisani LR, Currò M, Parisi G, Oteri G, Ientile R, Rossini PM, Pisani F.",Epilepsia. 2009 Jan;50 Suppl 1:33-6. doi: 10.1111/j.1528-1167.2008.01967.x.,Gorgone G,Epilepsia,2009,2009/01/08,,,10.1111/j.1528-1167.2008.01967.x
28398657,Study Exploring the Effects of Daily Supplementation with 400 μg of Folic Acid on the Nutritional Status of Folate in Women of Reproductive Age,"Arias LD, Parra BE, Muñoz AM, Cárdenas DL, Duque TG, Manjarrés LM.",Birth Defects Res. 2017 May 1;109(8):564-573. doi: 10.1002/bdr2.1004. Epub 2017 Mar 15.,Arias LD,Birth Defects Res,2017,2017/04/12,,,10.1002/bdr2.1004
16397167,Methylenetetrahydrofolate reductase polymorphisms and homocysteine-lowering effect of vitamin therapy in Singaporean stroke patients,"Ho GY, Eikelboom JW, Hankey GJ, Wong CR, Tan SL, Chan JB, Chen CP.",Stroke. 2006 Feb;37(2):456-60. doi: 10.1161/01.STR.0000199845.27512.84. Epub 2006 Jan 5.,Ho GY,Stroke,2006,2006/01/07,,,10.1161/01.STR.0000199845.27512.84
16040247,Endothelial function markers in parkinsonian patients with hyperhomocysteinemia,"Bostantjopoulou S, Katsarou Z, Frangia T, Hatzizisi O, Papazisis K, Kyriazis G, Kiosseoglou G, Kazis A.",J Clin Neurosci. 2005 Aug;12(6):669-72. doi: 10.1016/j.jocn.2004.09.012.,Bostantjopoulou S,J Clin Neurosci,2005,2005/07/26,,,10.1016/j.jocn.2004.09.012
12594357,The C677T mutation in the methylenetetrahydrofolate reductase gene among the Indonesian Javanese population,"Sadewa AH, Sunarti, Sutomo R, Hayashi C, Lee MJ, Ayaki H, Sofro AS, Matsuo M, Nishio H.",Kobe J Med Sci. 2002 Dec;48(5-6):137-44.,Sadewa AH,Kobe J Med Sci,2002,2003/02/21,,,
12433726,Susceptibility to gastric cardia adenocarcinoma and genetic polymorphisms in methylenetetrahydrofolate reductase in an at-risk Chinese population,"Miao X, Xing D, Tan W, Qi J, Lu W, Lin D.",Cancer Epidemiol Biomarkers Prev. 2002 Nov;11(11):1454-8.,Miao X,Cancer Epidemiol Biomarkers Prev,2002,2002/11/16,,,
11172470,Risk factors for atherosclerosis in survivors of myocardial infarction and their spouses: comparison to controls without personal and family history of atherosclerosis,"Raslová K, Smolková B, Vohnout B, Gasparovic J, Frohlich JJ.",Metabolism. 2001 Jan;50(1):24-9. doi: 10.1053/meta.2001.19499.,Raslová K,Metabolism,2001,2001/02/15,,,10.1053/meta.2001.19499
12792513,Vitamin supplementation reduces the progression of atherosclerosis in hyperhomocysteinemic renal-transplant recipients,"Marcucci R, Zanazzi M, Bertoni E, Rosati A, Fedi S, Lenti M, Prisco D, Castellani S, Abbate R, Salvadori M.",Transplantation. 2003 May 15;75(9):1551-5. doi: 10.1097/01.TP.0000058810.59825.58.,Marcucci R,Transplantation,2003,2003/06/07,,,10.1097/01.TP.0000058810.59825.58
15369744,Hyperhomocysteinemia in acute Plasmodium falciparum malaria: an effect of host-parasite interaction,"Chillemi R, Zappacosta B, Simporè J, Persichilli S, Musumeci M, Musumeci S.",Clin Chim Acta. 2004 Oct;348(1-2):113-20. doi: 10.1016/j.cccn.2004.05.007.,Chillemi R,Clin Chim Acta,2004,2004/09/17,,,10.1016/j.cccn.2004.05.007
25099492,Comparative pharmacogenetic analysis of risk polymorphisms in Caucasian and Vietnamese children with acute lymphoblastic leukemia: prediction of therapeutic outcome?,"Hoang PT, Ambroise J, Dekairelle AF, Durant JF, Butoescu V, Chi VL, Huynh N, Nguyen TB, Robert A, Vermylen C, Gala JL.",Br J Clin Pharmacol. 2015 Mar;79(3):429-40. doi: 10.1111/bcp.12481.,Hoang PT,Br J Clin Pharmacol,2015,2014/08/08,PMC4345953,,10.1111/bcp.12481
22023244,Detection of thrombophilic mutations related to spontaneous abortions by a multiplex SNaPshot method,"Madjunkova S, Volk M, Peterlin B, Plaseska-Karanfilska D.",Genet Test Mol Biomarkers. 2012 Apr;16(4):259-64. doi: 10.1089/gtmb.2011.0173. Epub 2011 Oct 24.,Madjunkova S,Genet Test Mol Biomarkers,2012,2011/10/26,PMC3326265,,10.1089/gtmb.2011.0173
31865785,Estimated Stroke-Free Survival of Folic Acid Therapy for Hypertensive Adults: Projection Based on the CSPPT,"Zhang T, Lin T, Wang Y, Wang B, Qin X, Xie F, Cui Y, Huo Y, Wang X, Zhang Z, Jiang J.",Hypertension. 2020 Feb;75(2):339-346. doi: 10.1161/HYPERTENSIONAHA.119.14102. Epub 2019 Dec 23.,Zhang T,Hypertension,2020,2019/12/24,PMC8020900,NIHMS1682898,10.1161/HYPERTENSIONAHA.119.14102
14586640,The thymidylate synthase tandem repeat polymorphism is not associated with homocysteine concentrations in healthy young subjects,"Brown KS, Kluijtmans LA, Young IS, McNulty H, Mitchell LE, Yarnell JW, Woodside JV, Boreham CA, McMaster D, Murray L, Strain JJ, Whitehead AS.",Hum Genet. 2004 Jan;114(2):182-5. doi: 10.1007/s00439-003-1039-9. Epub 2003 Oct 25.,Brown KS,Hum Genet,2004,2003/10/31,,,10.1007/s00439-003-1039-9
18797703,Reduced folate carrier 1 (RFC1) is associated with cleft of the lip only,"Vieira AR, Cooper ME, Marazita ML, Castilla EE, Orioli IM.",Braz J Med Biol Res. 2008 Aug;41(8):689-93. doi: 10.1590/s0100-879x2008000800009.,Vieira AR,Braz J Med Biol Res,2008,2008/09/18,,,10.1590/s0100-879x2008000800009
14669168,"Polycystic ovary syndrome, the G1691A factor V Leiden mutation, and plasminogen activator inhibitor activity: associations with recurrent pregnancy loss","Glueck CJ, Wang P, Bornovali S, Goldenberg N, Sieve L.",Metabolism. 2003 Dec;52(12):1627-32. doi: 10.1016/j.metabol.2003.06.001.,Glueck CJ,Metabolism,2003,2003/12/12,,,10.1016/j.metabol.2003.06.001
15470279,Combination of thrombophilia markers in acute myocardial infarction of the young,"Khare A, Ghosh K, Shetty S, Kulkarni B, Mohanty D.",Indian J Med Sci. 2004 Sep;58(9):381-8.,Khare A,Indian J Med Sci,2004,2004/10/08,,,
15117441,"Hyperhomocysteinaemia in a young woman presenting with stroke, associated with methylene tetrahydrofolate reductase C677T homozygosity","Saldana Chaparro R, Barron JL.",Ann Clin Biochem. 2004 May;41(Pt 3):241-4. doi: 10.1258/000456304323019640.,Saldana Chaparro R,Ann Clin Biochem,2004,2004/05/01,,,10.1258/000456304323019640
41288983,"Inherited Thrombophilia in Early-Onset Carotid Stenosis: A Comparative Study of Dissection, Atherosclerosis, Fibromuscular Dysplasia, and Other Etiologies","Marzioglu Ozdemir E, Ozdemir G.",Clin Appl Thromb Hemost. 2025 Jan-Dec;31:10760296251401577. doi: 10.1177/10760296251401577. Epub 2025 Nov 25.,Marzioglu Ozdemir E,Clin Appl Thromb Hemost,2025,2025/11/25,PMC12647536,,10.1177/10760296251401577