PMID,Title,Authors,Citation,First Author,Journal/Book,Publication Year,Create Date,PMCID,NIHMS ID,DOI
30684021,Folate pathway genetic polymorphisms modulate methotrexate-induced toxicity in childhood acute lymphoblastic leukemia,"Yousef AM, Farhad R, Alshamaseen D, Alsheikh A, Zawiah M, Kadi T.",Cancer Chemother Pharmacol. 2019 Apr;83(4):755-762. doi: 10.1007/s00280-019-03776-8. Epub 2019 Jan 25.,Yousef AM,Cancer Chemother Pharmacol,2019,2019/01/27,,,10.1007/s00280-019-03776-8
22983814,Vitamin B12 level in peripheral arterial disease,"Zsóri KS, Csiki Z, Katona É, Bereczky Z, Shemirani AH.",J Thromb Thrombolysis. 2013 Jul;36(1):77-83. doi: 10.1007/s11239-012-0807-6.,Zsóri KS,J Thromb Thrombolysis,2013,2012/09/18,,,10.1007/s11239-012-0807-6
22926161,Genotypes of the MTHFR C677T and MTRR A66G genes act independently to reduce migraine disability in response to vitamin supplementation,"Menon S, Lea RA, Roy B, Hanna M, Wee S, Haupt LM, Oliver C, Griffiths LR.",Pharmacogenet Genomics. 2012 Oct;22(10):741-9. doi: 10.1097/FPC.0b013e3283576b6b.,Menon S,Pharmacogenet Genomics,2012,2012/08/29,,,10.1097/FPC.0b013e3283576b6b
24459043,Predicting Hyperhomocysteinemia by Methylenetetrahydrofolate Reductase C677T Polymorphism in Chinese Patients With Hypertension,"Wang Y, Xu X, Huo Y, Liu D, Cui Y, Liu Z, Zhao Z, Xu X, Liu L, Li X, Jiang S.",Clin Appl Thromb Hemost. 2015 Oct;21(7):661-6. doi: 10.1177/1076029613519849. Epub 2014 Jan 22.,Wang Y,Clin Appl Thromb Hemost,2015,2014/01/25,,,10.1177/1076029613519849
30170616,Methylenetetrahydrofolate reductase polymorphism (MTHFR C677T) and headache in children: a retrospective study from a tertiary level outpatient service,"Orsini A, Sammartino I, Valetto A, Bertini V, Marchese P, Bonuccelli A, Peroni DG.",Ital J Pediatr. 2018 Aug 31;44(1):106. doi: 10.1186/s13052-018-0546-1.,Orsini A,Ital J Pediatr,2018,2018/09/02,PMC6119283,,10.1186/s13052-018-0546-1
25041994,Polymorphisms in folate-metabolizing enzymes and response to 5-fluorouracil among patients with stage II or III rectal cancer (INT-0144; SWOG 9304),"Ulrich CM, Rankin C, Toriola AT, Makar KW, Altug-Teber Ö, Benedetti JK, Holmes RS, Smalley SR, Blanke CD, Lenz HJ.",Cancer. 2014 Nov 1;120(21):3329-3337. doi: 10.1002/cncr.28830. Epub 2014 Jul 15.,Ulrich CM,Cancer,2014,2014/07/22,PMC4259283,NIHMS619839,10.1002/cncr.28830
17149733,Infant C677T MTHFR polymorphism and severe mental retardation,"Shaw GM, Jelliffe-Pawlowski L, Nelson V, Zhu H, Harris JA, Finnell RH.",Birth Defects Res A Clin Mol Teratol. 2007 Jan;79(1):24-6. doi: 10.1002/bdra.20321.,Shaw GM,Birth Defects Res A Clin Mol Teratol,2007,2006/12/07,,,10.1002/bdra.20321
17932361,Responses of biomarkers of folate and riboflavin status to folate and riboflavin supplementation in healthy and colorectal polyp patients (the FAB2 Study),"Powers HJ, Hill MH, Welfare M, Spiers A, Bal W, Russell J, Duckworth Y, Gibney E, Williams EA, Mathers JC.",Cancer Epidemiol Biomarkers Prev. 2007 Oct;16(10):2128-35. doi: 10.1158/1055-9965.EPI-07-0208.,Powers HJ,Cancer Epidemiol Biomarkers Prev,2007,2007/10/13,,,10.1158/1055-9965.EPI-07-0208
21113717,MTHFR C677T and A1298C polymorphisms and cerebral stroke in two twin gestations,"Arpino C, Compagnone E, Cacciatore D, Coniglio A, Castorina M, Curatolo P.",Childs Nerv Syst. 2011 Apr;27(4):665-9. doi: 10.1007/s00381-010-1340-6. Epub 2010 Nov 27.,Arpino C,Childs Nerv Syst,2011,2010/11/30,,,10.1007/s00381-010-1340-6
18322814,Folate and MTHFR: risk of adenoma recurrence in the Polyp Prevention Trial,"Murphy G, Sansbury LB, Cross AJ, Stolzenberg-Solomon R, Laiyemo A, Albert PS, Wang Z, Schatzkin A, Lehman T, Kalidindi A, Modali R, Lanza E.",Cancer Causes Control. 2008 Sep;19(7):751-8. doi: 10.1007/s10552-008-9137-6. Epub 2008 Mar 6.,Murphy G,Cancer Causes Control,2008,2008/03/07,,,10.1007/s10552-008-9137-6
10893069,Hyperhomocysteinemia and the MTHFR C677T mutation in central retinal vein occlusion,"Larsson J, Hultberg B, Hillarp A.",Acta Ophthalmol Scand. 2000 Jun;78(3):340-3. doi: 10.1034/j.1600-0420.2000.078003340.x.,Larsson J,Acta Ophthalmol Scand,2000,2000/07/13,,,10.1034/j.1600-0420.2000.078003340.x
32330571,Impact of the MTHFR C677T polymorphism on one-carbon metabolites: Evidence from a randomised trial of riboflavin supplementation,"Rooney M, Bottiglieri T, Wasek-Patterson B, McMahon A, Hughes CF, McCann A, Horigan G, Strain JJ, McNulty H, Ward M.",Biochimie. 2020 Jun;173:91-99. doi: 10.1016/j.biochi.2020.04.004. Epub 2020 Apr 21.,Rooney M,Biochimie,2020,2020/04/25,,,10.1016/j.biochi.2020.04.004
23244153,"Aberrant DNA methylation of P16, MGMT, and hMLH1 genes in combination with MTHFR C677T genetic polymorphism and folate intake in esophageal squamous cell carcinoma","Chen J, Huang ZJ, Duan YQ, Xiao XR, Jiang JQ, Zhang R.",Asian Pac J Cancer Prev. 2012;13(10):5303-6. doi: 10.7314/apjcp.2012.13.10.5303.,Chen J,Asian Pac J Cancer Prev,2012,2012/12/19,,,10.7314/apjcp.2012.13.10.5303
19326430,The MTHFR C677T and DeltaDNMT3B C-149T polymorphisms confer different risks for right- and left-sided colorectal cancer,"Iacopetta B, Heyworth J, Girschik J, Grieu F, Clayforth C, Fritschi L.",Int J Cancer. 2009 Jul 1;125(1):84-90. doi: 10.1002/ijc.24324.,Iacopetta B,Int J Cancer,2009,2009/03/28,,,10.1002/ijc.24324
22492374,Prospective study of methylenetetrahydrofolate reductase (MTHFR) variant C677T and risk of all-cause and cardiovascular disease mortality among 6000 US adults,"Yang Q, Bailey L, Clarke R, Flanders WD, Liu T, Yesupriya A, Khoury MJ, Friedman JM.",Am J Clin Nutr. 2012 May;95(5):1245-53. doi: 10.3945/ajcn.111.022384. Epub 2012 Apr 4.,Yang Q,Am J Clin Nutr,2012,2012/04/12,,,10.3945/ajcn.111.022384
26865327,Hyperhomocysteinaemia is an independent risk factor of abdominal aortic aneurysm in a Chinese Han population,"Liu J, Zuo SW, Li Y, Jia X, Jia SH, Zhang T, Song YX, Wei YQ, Xiong J, Hu YH, Guo W.",Sci Rep. 2016 Feb 11;6:17966. doi: 10.1038/srep17966.,Liu J,Sci Rep,2016,2016/02/12,PMC4750057,,10.1038/srep17966
21845428,Evaluation of the MTHFR A1298C variant in leukoaraiosis,"Szolnoki Z, Szaniszlo I, Szekeres M, Hitri K, Kondacs A, Mandi Y, Nedo E, Somogyvari F.",J Mol Neurosci. 2012 Mar;46(3):492-6. doi: 10.1007/s12031-011-9621-4. Epub 2011 Aug 16.,Szolnoki Z,J Mol Neurosci,2012,2011/08/17,,,10.1007/s12031-011-9621-4
12097662,Vitamin B-12 status is inversely associated with plasma homocysteine in young women with C677T and/or A1298C methylenetetrahydrofolate reductase polymorphisms,"Bailey LB, Duhaney RL, Maneval DR, Kauwell GP, Quinlivan EP, Davis SR, Cuadras A, Hutson AD, Gregory JF 3rd.",J Nutr. 2002 Jul;132(7):1872-8. doi: 10.1093/jn/132.7.1872.,Bailey LB,J Nutr,2002,2002/07/05,,,10.1093/jn/132.7.1872
25550183,Elevation in Total Homocysteine Levels in Chinese Patients With Essential Hypertension Treated With Antihypertensive Benazepril,"Jiang S, Pan M, Wu S, Venners SA, Zhong G, Hsu YH, Weinstock J, Wang B, Tang G, Liu D, Xu X.",Clin Appl Thromb Hemost. 2016 Mar;22(2):191-8. doi: 10.1177/1076029614565881. Epub 2014 Dec 30.,Jiang S,Clin Appl Thromb Hemost,2016,2015/01/01,,,10.1177/1076029614565881
19034339,Synergistic effect of methyltetrahydrofolate reductase (MTHFR) C677T and A1298C polymorphism as risk modifiers of pediatric acute lymphoblastic leukemia,"Kamel AM, Moussa HS, Ebid GT, Bu RR, Bhatia KG.",J Egypt Natl Canc Inst. 2007 Jun;19(2):96-105.,Kamel AM,J Egypt Natl Canc Inst,2007,2008/11/27,,,
25412139,Association of C677T transition of the human methylenetetrahydrofolate reductase (MTHFR) gene with male infertility,"Karimian M, Colagar AH.",Reprod Fertil Dev. 2016 Apr;28(6):785-94. doi: 10.1071/RD14186.,Karimian M,Reprod Fertil Dev,2016,2014/11/21,,,10.1071/RD14186
25392189,Determinants of maternal pregnancy one-carbon metabolism and newborn human DNA methylation profiles,"van Mil NH, Bouwland-Both MI, Stolk L, Verbiest MM, Hofman A, Jaddoe VW, Verhulst FC, Eilers PH, Uitterlinden AG, Steegers EA, Tiemeier H, Steegers-Theunissen RP.",Reproduction. 2014 Dec;148(6):581-92. doi: 10.1530/REP-14-0260.,van Mil NH,Reproduction,2014,2014/11/14,,,10.1530/REP-14-0260
26745044,Evaluation of the MTHFR C677T Polymorphism as a Risk Factor for Colorectal Cancer in Asian Populations,Rai V.,Asian Pac J Cancer Prev. 2015;16(18):8093-100. doi: 10.7314/apjcp.2015.16.18.8093.,Rai V,Asian Pac J Cancer Prev,2015,2016/01/09,,,10.7314/apjcp.2015.16.18.8093
15916056,Methylenetetrahydrofolate reductase (MTHFR) polymorphism (C677T) in relation to homocysteine concentration in overweight and obese Thais,"Thawnashom K, Tungtrongchitr R, Petmitr S, Pongpaew P, Phonrat B, Tungtrongchitr A, Schelp FP.",Southeast Asian J Trop Med Public Health. 2005 Mar;36(2):459-66.,Thawnashom K,Southeast Asian J Trop Med Public Health,2005,2005/05/27,,,
18574671,Methylenetetrahydrofolate reductase (MTHFR) C677T genetic polymorphism and late infarct-related coronary artery patency after thrombolysis,"Patti G, Fossati C, Nusca A, Mega S, Pasceri V, D'Ambrosio A, Giannetti B, Annibali O, Avvisati G, Di Sciascio G.",J Thromb Thrombolysis. 2009 May;27(4):413-20. doi: 10.1007/s11239-008-0235-9. Epub 2008 Jun 25.,Patti G,J Thromb Thrombolysis,2009,2008/06/25,,,10.1007/s11239-008-0235-9
16641680,"Serum homocysteine, folate level and methylenetetrahydrofolate reductase 677, 1298 gene polymorphism in Korean schizophrenic patients","Lee YS, Han DH, Jeon CM, Lyoo IK, Na C, Chae SL, Cho SC.",Neuroreport. 2006 May 15;17(7):743-6. doi: 10.1097/01.wnr.0000215777.99473.52.,Lee YS,Neuroreport,2006,2006/04/28,,,10.1097/01.wnr.0000215777.99473.52
28887233,Methotrexate pharmacogenetics in Uruguayan adults with hematological malignant diseases,"Giletti A, Vital M, Lorenzo M, Cardozo P, Borelli G, Gabus R, Martínez L, Díaz L, Assar R, Rodriguez MN, Esperón P.",Eur J Pharm Sci. 2017 Nov 15;109:480-485. doi: 10.1016/j.ejps.2017.09.006. Epub 2017 Sep 5.,Giletti A,Eur J Pharm Sci,2017,2017/09/10,,,10.1016/j.ejps.2017.09.006
21625172,The basis of differential responses to folic acid supplementation,"Cotlarciuc I, Andrew T, Dew T, Clement G, Gill R, Surdulescu G, Sherwood R, Ahmadi KR.",J Nutrigenet Nutrigenomics. 2011;4(2):99-109. doi: 10.1159/000327768. Epub 2011 May 28.,Cotlarciuc I,J Nutrigenet Nutrigenomics,2011,2011/06/01,,,10.1159/000327768
15044114,Gene-nutrient and gene-gene interactions of controlled folate intake by Japanese women,"Hiraoka M, Kato K, Saito Y, Yasuda K, Kagawa Y.",Biochem Biophys Res Commun. 2004 Apr 16;316(4):1210-6. doi: 10.1016/j.bbrc.2004.02.174.,Hiraoka M,Biochem Biophys Res Commun,2004,2004/03/27,,,10.1016/j.bbrc.2004.02.174
21612398,Methylenetetrahydrofolate reductase C677T and A1298C polymorphisms and nonsyndromic orofacial clefts susceptibility in a southern Chinese population,"Han Y, Pan Y, Du Y, Tong N, Wang M, Zhang Z, Wan L, Wang L.",DNA Cell Biol. 2011 Dec;30(12):1063-8. doi: 10.1089/dna.2010.1185. Epub 2011 May 25.,Han Y,DNA Cell Biol,2011,2011/05/27,,,10.1089/dna.2010.1185
25529062,Distribution and determinants of plasma homocysteine levels in rural Chinese twins across the lifespan,"Ji Y, Kong X, Wang G, Hong X, Xu X, Chen Z, Bartell T, Xu X, Tang G, Hou F, Huo Y, Wang X, Wang B.",Nutrients. 2014 Dec 18;6(12):5900-14. doi: 10.3390/nu6125900.,Ji Y,Nutrients,2014,2014/12/23,PMC4277006,,10.3390/nu6125900
24274352,Green tea consumption and breast cancer risk in Japanese women: a case-control study,"Iwasaki M, Mizusawa J, Kasuga Y, Yokoyama S, Onuma H, Nishimura H, Kusama R, Tsugane S.",Nutr Cancer. 2014;66(1):57-67. doi: 10.1080/01635581.2014.847963. Epub 2013 Nov 25.,Iwasaki M,Nutr Cancer,2014,2013/11/27,,,10.1080/01635581.2014.847963
16686913,Metabolic and genetic risk factors for migraine in children,"Bottini F, Celle ME, Calevo MG, Amato S, Minniti G, Montaldi L, Di Pasquale D, Cerone R, Veneselli E, Molinari AC.",Cephalalgia. 2006 Jun;26(6):731-7. doi: 10.1111/j.1468-2982.2006.01107.x.,Bottini F,Cephalalgia,2006,2006/05/12,,,10.1111/j.1468-2982.2006.01107.x
22385294,Gender-specific association of methylenetetrahydrofolate reductase gene polymorphisms with sporadic amyotrophic lateral sclerosis,"Sazci A, Ozel MD, Emel E, Idrisoglu HA.",Genet Test Mol Biomarkers. 2012 Jul;16(7):716-21. doi: 10.1089/gtmb.2011.0313. Epub 2012 Mar 2.,Sazci A,Genet Test Mol Biomarkers,2012,2012/03/06,,,10.1089/gtmb.2011.0313
23456769,Response of serum and red blood cell folate concentrations to folic acid supplementation depends on methylenetetrahydrofolate reductase C677T genotype: results from a crossover trial,"Anderson CA, Beresford SA, McLerran D, Lampe JW, Deeb S, Feng Z, Motulsky AG.",Mol Nutr Food Res. 2013 Apr;57(4):637-44. doi: 10.1002/mnfr.201200108. Epub 2013 Mar 4.,Anderson CA,Mol Nutr Food Res,2013,2013/03/05,PMC4132693,NIHMS507741,10.1002/mnfr.201200108
24460828,"5,10-Methylenetetrahydrofolate reductase single nucleotide polymorphisms and gene-environment interaction analysis in non-syndromic cleft lip/palate","Estandia-Ortega B, Velázquez-Aragón JA, Alcántara-Ortigoza MA, Reyna-Fabian ME, Villagómez-Martínez S, González-Del Angel A.",Eur J Oral Sci. 2014 Apr;122(2):109-13. doi: 10.1111/eos.12114. Epub 2014 Jan 24.,Estandia-Ortega B,Eur J Oral Sci,2014,2014/01/28,,,10.1111/eos.12114
28211809,The Methylenetetrahydrofolate Reductase C677T Polymorphism and Risk for Late-Onset Alzheimer's disease: Further Evidence in an Italian Multicenter Study,"Stoccoro A, Tannorella P, Salluzzo MG, Ferri R, Romano C, Nacmias B, Siciliano G, Migliore L, Coppedè F.",J Alzheimers Dis. 2017;56(4):1451-1457. doi: 10.3233/JAD-161081.,Stoccoro A,J Alzheimers Dis,2017,2017/02/18,,,10.3233/JAD-161081
15985285,Influence of combined methylenetetrahydrofolate reductase (MTHFR) and thymidylate synthase enhancer region (TSER) polymorphisms to plasma homocysteine levels in Korean patients with recurrent spontaneous abortion,"Kim NK, Choi YK, Kang MS, Choi DH, Cha SH, An MO, Lee S, Jeung M, Ko JJ, Oh D.",Thromb Res. 2006;117(6):653-8. doi: 10.1016/j.thromres.2005.05.025. Epub 2005 Jun 27.,Kim NK,Thromb Res,2006,2005/06/30,,,10.1016/j.thromres.2005.05.025
12020105,"B-vitamin intake, metabolic genes, and colorectal cancer risk (United States)","Le Marchand L, Donlon T, Hankin JH, Kolonel LN, Wilkens LR, Seifried A.",Cancer Causes Control. 2002 Apr;13(3):239-48. doi: 10.1023/a:1015057614870.,Le Marchand L,Cancer Causes Control,2002,2002/05/22,,,10.1023/a:1015057614870
18165972,"No association with the 5,10-methylenetetrahydrofolate reductase gene and major depressive disorder: results of the depression case control (DeCC) study and a meta-analysis","Gaysina D, Cohen S, Craddock N, Farmer A, Hoda F, Korszun A, Owen MJ, Craig IW, McGuffin P.",Am J Med Genet B Neuropsychiatr Genet. 2008 Sep 5;147B(6):699-706. doi: 10.1002/ajmg.b.30665.,Gaysina D,Am J Med Genet B Neuropsychiatr Genet,2008,2008/01/01,,,10.1002/ajmg.b.30665
17333388,MTHFR 677 CT/MTHFR 1298 CC genotypes are associated with increased risk of hypertension in Indians,"Markan S, Sachdeva M, Sehrawat BS, Kumari S, Jain S, Khullar M.",Mol Cell Biochem. 2007 Aug;302(1-2):125-31. doi: 10.1007/s11010-007-9434-5. Epub 2007 Mar 1.,Markan S,Mol Cell Biochem,2007,2007/03/03,,,10.1007/s11010-007-9434-5
18708408,"Vitamins B2, B6, and B12 and risk of new colorectal adenomas in a randomized trial of aspirin use and folic acid supplementation","Figueiredo JC, Levine AJ, Grau MV, Midttun O, Ueland PM, Ahnen DJ, Barry EL, Tsang S, Munroe D, Ali I, Haile RW, Sandler RS, Baron JA.",Cancer Epidemiol Biomarkers Prev. 2008 Aug;17(8):2136-45. doi: 10.1158/1055-9965.EPI-07-2895.,Figueiredo JC,Cancer Epidemiol Biomarkers Prev,2008,2008/08/19,PMC2518404,NIHMS56152,10.1158/1055-9965.EPI-07-2895
16234842,The effect of MTHFR(C677T) genotype on plasma homocysteine concentrations in healthy children is influenced by gender,"Papoutsakis C, Yiannakouris N, Manios Y, Papaconstantinou E, Magkos F, Schulpis KH, Zampelas A, Matalas AL.",Eur J Clin Nutr. 2006 Feb;60(2):155-62. doi: 10.1038/sj.ejcn.1602280.,Papoutsakis C,Eur J Clin Nutr,2006,2005/10/20,,,10.1038/sj.ejcn.1602280
15002923,Serum total homocysteine levels and the prevalence of folic acid deficiency and C677T mutation at the MTHFR gene in an indigenous population of Amazonia: the relationship of homocysteine with other cardiovascular risk factors,"Tavares EF, Vieira-Filho JP, Andriolo A, Perez AB, Vergani N, Sañudo A, Gimeno SG, Franco LJ.",Ethn Dis. 2004 Winter;14(1):49-56.,Tavares EF,Ethn Dis,2004,2004/03/09,,,
15613145,MTHFR C677T gene mutation as a risk factor for arterial stroke: a hospital based study,"Alluri RV, Mohan V, Komandur S, Chawda K, Chaudhuri JR, Hasan Q.",Eur J Neurol. 2005 Jan;12(1):40-4. doi: 10.1111/j.1468-1331.2004.00938.x.,Alluri RV,Eur J Neurol,2005,2004/12/23,,,10.1111/j.1468-1331.2004.00938.x
12907815,"Elevated plasma homocysteine was associated with hemorrhagic and ischemic stroke, but methylenetetrahydrofolate reductase gene C677T polymorphism was a risk factor for thrombotic stroke: a Multicenter Case-Control Study in China","Li Z, Sun L, Zhang H, Liao Y, Wang D, Zhao B, Zhu Z, Zhao J, Ma A, Han Y, Wang Y, Shi Y, Ye J, Hui R; Multicenter Case-Control Study in China.",Stroke. 2003 Sep;34(9):2085-90. doi: 10.1161/01.STR.0000086753.00555.0D. Epub 2003 Aug 7.,Li Z,Stroke,2003,2003/08/09,,,10.1161/01.STR.0000086753.00555.0D
21385350,Hearing impairment risk and interaction of folate metabolism related gene polymorphisms in an aging study,"Uchida Y, Sugiura S, Ando F, Nakashima T, Shimokata H.",BMC Med Genet. 2011 Mar 7;12:35. doi: 10.1186/1471-2350-12-35.,Uchida Y,BMC Med Genet,2011,2011/03/10,PMC3063203,,10.1186/1471-2350-12-35
12571666,A comparison of the effect of advice to eat either '5-a-day' fruit and vegetables or folic acid-fortified foods on plasma folate and homocysteine,"Ashfield-Watt PA, Whiting JM, Clark ZE, Moat SJ, Newcombe RG, Burr ML, McDowell IF.",Eur J Clin Nutr. 2003 Feb;57(2):316-23. doi: 10.1038/sj.ejcn.1601545.,Ashfield-Watt PA,Eur J Clin Nutr,2003,2003/02/07,,,10.1038/sj.ejcn.1601545
15589218,Methylenetetrahydrofolate reductase polymorphism (MTHFR C677T) and bone mineral density in Chinese men and women,"Li M, Lau EM, Woo J.",Bone. 2004 Dec;35(6):1369-74. doi: 10.1016/j.bone.2004.09.008.,Li M,Bone,2004,2004/12/14,,,10.1016/j.bone.2004.09.008
15136061,"The 5,10-methylenetetrahydrofolate reductase C677T polymorphism interacts with smoking to increase homocysteine","Brown KS, Kluijtmans LA, Young IS, Murray L, McMaster D, Woodside JV, Yarnell JW, Boreham CA, McNulty H, Strain JJ, McPartlin J, Scott JM, Mitchell LE, Whitehead AS.",Atherosclerosis. 2004 Jun;174(2):315-22. doi: 10.1016/j.atherosclerosis.2004.01.023.,Brown KS,Atherosclerosis,2004,2004/05/12,,,10.1016/j.atherosclerosis.2004.01.023
26450530,Fetal Val108/158Met catechol-O-methyltransferase (COMT) polymorphism and placental COMT activity are associated with the development of preeclampsia,"Pertegal M, Fenoy FJ, Hernández M, Mendiola J, Delgado JL, Bonacasa B, Corno A, López B, Bosch V, Hernández I.",Fertil Steril. 2016 Jan;105(1):134-43.e1-3. doi: 10.1016/j.fertnstert.2015.09.019. Epub 2015 Oct 9.,Pertegal M,Fertil Steril,2016,2015/10/10,,,10.1016/j.fertnstert.2015.09.019
11228493,"Mutations in the gene for methylenetetrahydrofolate reductase, homocysteine levels, and vitamin status in women with a history of preeclampsia","Lachmeijer AM, Arngrímsson R, Bastiaans EJ, Pals G, ten Kate LP, de Vries JI, Kostense PJ, Aarnoudse JG, Dekker GA.",Am J Obstet Gynecol. 2001 Feb;184(3):394-402. doi: 10.1067/mob.2001.109393.,Lachmeijer AM,Am J Obstet Gynecol,2001,2001/03/03,,,10.1067/mob.2001.109393
16141796,The pharmacogenetics of methotrexate in inflammatory bowel disease,"Herrlinger KR, Cummings JR, Barnardo MC, Schwab M, Ahmad T, Jewell DP.",Pharmacogenet Genomics. 2005 Oct;15(10):705-11. doi: 10.1097/01.fpc.0000172242.19675.33.,Herrlinger KR,Pharmacogenet Genomics,2005,2005/09/06,,,10.1097/01.fpc.0000172242.19675.33
26991917,Effect of folic acid supplementation on cancer risk among adults with hypertension in China: A randomized clinical trial,"Qin X, Shen L, Zhang R, Li Y, Wang X, Wang B, Jiang X, Jiang H, Lei Y, Hou FF, Gu J, Huo Y.",Int J Cancer. 2017 Aug 15;141(4):837-847. doi: 10.1002/ijc.30094. Epub 2017 Jun 5.,Qin X,Int J Cancer,2017,2016/03/19,,,10.1002/ijc.30094
19594372,MTHFR C677T genotype frequency in patients of Middle Eastern descent as determined by real-time PCR and melting curve analysis,"Haghighatgoo A, Valles-Ayoub Y, Saechao C, Esfandiarifard S, Martinez SL, Pietruszka M, Darvish D.",Genet Test Mol Biomarkers. 2009 Aug;13(4):471-6. doi: 10.1089/gtmb.2009.0008.,Haghighatgoo A,Genet Test Mol Biomarkers,2009,2009/07/15,,,10.1089/gtmb.2009.0008
17027242,Circulating homocysteine levels in patients with type 2 diabetes mellitus,"Ndrepepa G, Kastrati A, Braun S, Koch W, Kölling K, Mehilli J, Schömig A.",Nutr Metab Cardiovasc Dis. 2008 Jan;18(1):66-73. doi: 10.1016/j.numecd.2006.03.007. Epub 2006 Oct 5.,Ndrepepa G,Nutr Metab Cardiovasc Dis,2008,2006/10/10,,,10.1016/j.numecd.2006.03.007
16524711,Additional food folate derived exclusively from natural sources improves folate status in young women with the MTHFR 677 CC or TT genotype,"Hung J, Yang TL, Urrutia TF, Li R, Perry CA, Hata H, Cogger EA, Moriarty DJ, Caudill MA.",J Nutr Biochem. 2006 Nov;17(11):728-34. doi: 10.1016/j.jnutbio.2005.11.009. Epub 2005 Dec 22.,Hung J,J Nutr Biochem,2006,2006/03/10,,,10.1016/j.jnutbio.2005.11.009
23643559,Plasma total homocysteine is associated with abdominal aortic aneurysm and aortic diameter in older men,"Wong YY, Golledge J, Flicker L, McCaul KA, Hankey GJ, van Bockxmeer FM, Yeap BB, Norman PE.",J Vasc Surg. 2013 Aug;58(2):364-70. doi: 10.1016/j.jvs.2013.01.046. Epub 2013 May 3.,Wong YY,J Vasc Surg,2013,2013/05/07,,,10.1016/j.jvs.2013.01.046
14607573,C677T methylenetetrahydrofolate reductase polymorphism interferes with the effects of folic acid and zinc sulfate on sperm concentration,"Ebisch IM, van Heerde WL, Thomas CM, van der Put N, Wong WY, Steegers-Theunissen RP.",Fertil Steril. 2003 Nov;80(5):1190-4. doi: 10.1016/s0015-0282(03)02157-5.,Ebisch IM,Fertil Steril,2003,2003/11/11,,,10.1016/s0015-0282(03)02157-5
26687138,Association of Methylenetetrahydrafolate Reductase Gene Polymorphism (MTHFR) in Patients with Gallbladder Cancer,"Dixit R, Singh G, Pandey M, Basu S, Bhartiya SK, Singh KK, Shukla VK.",J Gastrointest Cancer. 2016 Mar;47(1):55-60. doi: 10.1007/s12029-015-9794-0.,Dixit R,J Gastrointest Cancer,2016,2015/12/22,,,10.1007/s12029-015-9794-0
21406306,Evaluation of MTHFR C677T polymorphism in ischemic and hemorrhagic stroke patients. A case-control study in a Northern Indian population,"Somarajan BI, Kalita J, Mittal B, Misra UK.",J Neurol Sci. 2011 May 15;304(1-2):67-70. doi: 10.1016/j.jns.2011.02.010. Epub 2011 Mar 15.,Somarajan BI,J Neurol Sci,2011,2011/03/17,,,10.1016/j.jns.2011.02.010
12453860,Preponderance of methylenetetrahydrofolate reductase C677T homozygosity among leukemia patients intolerant to methotrexate,"Chiusolo P, Reddiconto G, Casorelli I, Laurenti L, Sorà F, Mele L, Annino L, Leone G, Sica S.",Ann Oncol. 2002 Dec;13(12):1915-8. doi: 10.1093/annonc/mdf322.,Chiusolo P,Ann Oncol,2002,2002/11/28,,,10.1093/annonc/mdf322
18200034,Effect of ACE inhibitors and beta-blockers on homocysteine levels in essential hypertension,"Poduri A, Kaur J, Thakur JS, Kumari S, Jain S, Khullar M.",J Hum Hypertens. 2008 Apr;22(4):289-94. doi: 10.1038/sj.jhh.1002325. Epub 2008 Jan 17.,Poduri A,J Hum Hypertens,2008,2008/01/18,,,10.1038/sj.jhh.1002325
15244514,Polymorphisms in thymidylate synthase and methylenetetrahydrofolate reductase genes and the susceptibility to esophageal and stomach cancer with smoking,"Gao CM, Takezaki T, Wu JZ, Liu YT, Ding JH, Li SP, Su P, Hu X, Kai HT, Li ZY, Matsuo K, Hamajima N, Sugimura H, Tajima K.",Asian Pac J Cancer Prev. 2004 Apr-Jun;5(2):133-8.,Gao CM,Asian Pac J Cancer Prev,2004,2004/07/13,,,
30401001,Effect of long-term low-dose folic acid supplementation on degree of total homocysteine-lowering: major effect modifiers,"Wang B, Wu H, Li Y, Ban Q, Huang X, Chen L, Li J, Zhang Y, Cui Y, He M, Tang G, Yin D, Li J, Huo Y, Qin X, Xu X.",Br J Nutr. 2018 Nov;120(10):1122-1130. doi: 10.1017/S0007114518002477.,Wang B,Br J Nutr,2018,2018/11/08,,,10.1017/S0007114518002477
22084937,Modulator effects of the methylenetetrahydrofolate reductase C677T polymorphism on response to vitamin B12 therapy and homocysteine metabolism,"Sensoy N, Şoysal Y, Kahraman A, Doğan N, Imirzalioğlu N.",DNA Cell Biol. 2012 May;31(5):820-5. doi: 10.1089/dna.2011.1422. Epub 2011 Nov 15.,Sensoy N,DNA Cell Biol,2012,2011/11/17,,,10.1089/dna.2011.1422
21613384,Methylenetetrahydrofolate reductase (MTHFR) polymorphism A1298C (Glu429Ala) predicts decline in renal function over time in the African-American Study of Kidney Disease and Hypertension (AASK) Trial and Veterans Affairs Hypertension Cohort (VAHC),"Fung MM, Salem RM, Lipkowitz MS, Bhatnagar V, Pandey B, Schork NJ, O'Connor DT; AASK Study Investigators.",Nephrol Dial Transplant. 2012 Jan;27(1):197-205. doi: 10.1093/ndt/gfr257. Epub 2011 May 25.,Fung MM,Nephrol Dial Transplant,2012,2011/05/27,PMC3350339,,10.1093/ndt/gfr257
15449187,Methylenetetrahydrofolate reductase C677T polymorphism and predisposition towards esophageal squamous cell carcinoma in a German Caucasian and a northern Chinese population,"Zhang J, Zotz RB, Li Y, Wang R, Kiel S, Schulz WA, Wen D, Chen Z, Zhang L, Wang S, Gabbert HE, Sarbia M.",J Cancer Res Clin Oncol. 2004 Oct;130(10):574-80. doi: 10.1007/s00432-004-0585-4. Epub 2004 Jul 29.,Zhang J,J Cancer Res Clin Oncol,2004,2004/09/28,PMC12161787,,10.1007/s00432-004-0585-4
